supplier_name,awarded_amt
01 computer system pte ltd,3532966.59
1 cell bio inc,175227.52
1-net singapore pte ltd,2349343.73
"1light media, inc",91180.0
1survey associates,249100.0
2 ic catering private limited,5.5
23.5 degree g-architects pte. ltd.,2584880.0
2nd pet taxi & cremation services,3180.0
3-sixty brand communications pte. ltd.,5487716.5
388 pte. ltd.,0.0
3ad group pte. ltd.,118430.0
3c property consultants pte. ltd.,0.01
3d networks singapore pte. ltd.,8671462.4
3m technologies (s) pte. ltd.,293120.0
3p ecotecture pte. ltd.,1342800.0
3s communication pte. ltd.,832650.0
3si pte. ltd.,157397.0
3waves energy pte. ltd.,21960.0
4n limited,89472.0
5 estrelas sistemas de seguranca ltda,608951.0
6-sigma automation pte. ltd.,164500.0
800 super waste management pte ltd,148571067.72
9g elevator pte. ltd.,2973611.88
a plus engrg & services pte. ltd.,689164.3
a+b edu tours and travel pte. ltd.,708575.96
a-geo. survey consultants,0.0
a-one air-conditioning pte ltd,529200.0
a-sonic logistics pte. ltd.,17637469.96
a-speed infotech pte. ltd.,186888.0
a-tune software inc.,170000.0
a.g.t marketing pte ltd,56235.0
a.max pte ltd,723228.1599999999
aa vehicle inspection centre pte ltd,4249530.0
aadvantage consulting group pte. ltd.,3422171.5
aam geospatial pte. ltd.,340551.1
aam pty ltd,6178654.0
aaron wills & co. private limited,277082.0
aaxonn pte. ltd.,1399.9
ab associates pte. ltd.,348000.0
ab sciex (distribution),7853071.0
abacus property management private limited,43080.0
abb pte. ltd.,5831259.88
abbott informatics singapore pte. limited,1426297.9
abeltec international pte ltd,133000.0
aberdeen asset management asia limited,1.0
abi research singapore pte. ltd.,63022.23
abingdon construction pte. ltd.,186000.0
abj pte ltd,5988400.0
abl consultants pte. ltd.,616820.0
abramtle international pte. ltd.,946490.45
absg consulting inc.,606094.0
absolute kinetics consultancy pte ltd,23760.0
absolute maintenance services pte ltd,17115750.0
abv systems pte ltd,743360.0
abvolution wellness,249930.2
ac&cs (pte.) ltd.,97700.0
aca engrg pte ltd,1068565.1
academy communication pte. ltd.,26700.0
academy of medicine singapore,493576.0
academy of sports and exercise science pte. ltd.,875813.44
acadian asset management (singapore) pte ltd,290000.0
accel systems & technologies pte ltd,2311401.0
accenture pte ltd,519241786.44000006
acclaim insurance brokers pte. ltd.,3003606.8099999996
acclaim systems pte. ltd.,104400.0
acclivis technologies and solutions pte. ltd.,15726443.0
accon engineering pte ltd,1961664.0
accord test equipment,66645.0
acculex solutions pte. ltd.,168000.0
accurate general corp.,268442.24
accurate general gorp.,623178.73
ace armadillo pte ltd,64080.0
ace land survey,315399.0
"ace recreation, sports & wellness pte. ltd.",88000.0
ace sports sg,15480.0
ace water pte. ltd.,17263240.0
ace-tone solutions,21890.0
ace:daytons communications pte. ltd.,51931.1
aceplp.com pte ltd,738272.02
aceproject construction pte. ltd.,2154255.0
acer computer (singapore) pte ltd,6917898.0
acerpacer consulting pte. ltd.,529900.0
aces system development pte ltd,4640000.0
acesian star (s) pte. ltd.,1038730.2
acexon technologies pte. ltd.,674780.0
achema pte ltd,38594.32
achievers plus llp,663526.0
acl services (singapore) pte. ltd.,43119.0
acme associates pte. ltd.,8680000.0
acme chemicals (far east) pte ltd,4004650.0
acom asian resources pte. ltd.,348240.0
acoustic & lighting system pte. ltd.,147600.0
acoustic group pte. ltd.,331891.63
acp computer training school pte. ltd.,41880.0
acp office supplies pte. ltd.,833000.0
acre engineering pte ltd,3994843.0
acromec engineers pte ltd,24184307.509999998
activants pte ltd,4760000.0
activate interactive pte ltd,2317767.0
active 8 pte ltd,92689.0
active lifestyle pte ltd,1065120.0
activiste pte. ltd.,412000.0
acuate private limited,376484.0
adam khoo leadership company pte. ltd.,268490.0
adam khoo life skills company pte. ltd.,925216.0
adam khoo love for learning company pte. ltd.,429850.0
adam khoo outdoor company pte. ltd.,575098.0
addiction advertising pte. ltd.,3353604.71
addp architects llp,3609100.0
adecco personnel pte ltd,3862124.0
adele educational psychology services,42820.0
adelphi digital consulting group pte. ltd.,5115104.0
ademco (far east) pte ltd,3784816.0
ades engineering pte ltd,163936.0
adhesive pr,942722.95
admaterials technologies pte. ltd.,247400.0
adnovum singapore pte. ltd.,2042600.0
adobe systems software ireland limited,1079742.56
adred creation holdings pte. ltd.,49000.0
adrenalin group pte. ltd.,473182.25
adrian fisher design limited,495500.0
adsolution,180400.0
adtec enterprise pte ltd,27440.0
adtitude pte ltd,121666.0
advan engineering pte. ltd.,989641.0
advance laboratory system engineering pte. ltd.,2879966.0
advance membrane system pte ltd,113800.0
advance pinnacle technologies private limited,1109160.0
advance sports technologies pte. ltd.,2205047.0
advance survey consultant pte. ltd.,810550.0
advance-tec engineering pte. ltd.,266850.0
advanced business software and solutions pte. ltd.,763300.0
advanced cae pte. ltd.,280721.0
advanced construction & engineering pte ltd,4575510.0
advanced engineering group (international) pte. ltd.,439300.0
advanced material engineering pte. ltd.,2726885.85
advanced tech irrigation golf pte. ltd.,231300.0
advanced vacuum scandinavia ab,397900.0
advancelab (s) pte. ltd.,456010.0
advant engineering pte. ltd.,491245.0
advantage health benefits pte. ltd.,1951163.0
advanti technology pte. ltd.,1465614.6
adventra pte. ltd.,5067338.85
adventure plus pte. ltd.,487800.0
adventure systems pte. ltd.,379940.0
adventurer's singapore pte ltd,4137879.66
adventurer's sports & event pte. ltd.,112618.5
advion ltd,142538.0
adwyn impex pvt ltd,83383.3
ae models team pte ltd,360340.0
aecom singapore pte. ltd.,65760299.8
aedas pte. ltd.,59095994.5
aedge holdings pte ltd,6466388.0
aedge services pte. ltd.,1750380.0
aeg power solutions pte. ltd.,261484.0
aegis engineering pte. ltd.,1402527.0
aeradio technology pte ltd,831726.79
aero-marine vehicles,698200.0
aetos guard services pte. ltd.,5038036.55
aetos security management pte. ltd.,105038397.0
aetos training academy pte. ltd.,176960.0
afon pte. ltd.,179700.0
agape professional development consultancy,5320.0
"agape, connecting people pte. ltd.",471630.0
agarwal sumit,150000.0
age neonlight & signcrafts pte ltd,75476.0
agence france presse,250000.0
agenda,449181.0
aggasys solutions pte. ltd.,25292.0
agilent technologies singapore (sales) pte ltd,10488942.499999998
agitech innovations private limited,4808658.9
agog expo pte. ltd.,170000.0
agri opus proba pte. ltd.,607801.99
agricultural tractors spares pte ltd,145160.0
agro technic pte ltd,949200.0
ags consultants pte. ltd.,9000.0
ah boon civil engineering & building contractor pte ltd,47355000.0
ai4r,325965.0
aig asia pacific insurance pte. ltd.,2550994.35
aig edenspiekermann limited,796960.0
aik leong plumbing construction pte ltd,73610575.0
aik moh paints & chemicals pte ltd,142207.5
aik san construction pte ltd,750000.0
aik sun demolition & engineering pte ltd,4240750.0
aikly paints and chemical pte ltd,1000.0
aim fire systems & engineering pte. ltd.,568800.0
aims productions llp,252990.0
air & air services pte ltd,1135776.0
air liquide singapore private limited,19331136.849999998
air products singapore industrial gases pte. ltd.,243048.0
air transport training college pte ltd,104000.0
air venture airconditioning pte ltd,725743.0
airborne support group llc,257779.55
airbus asia training centre pte. ltd.,104800.0
airelated services pte. ltd.,248333.0
airfresh building services pte. ltd.,955484.0
airport equipment services pte ltd,150300.0
airverclean pte ltd,99569.0
aitbiotech pte. ltd.,433305.16
aitech mechatronics (s) pte. ltd.,270000.0
aitech robotics and automation pte. ltd.,601603.0
aj jetting pte. ltd.,273600.0
"aja international, inc.",521832.66000000003
akeles consulting pte. ltd.,301480.0
akrobat pte. ltd.,387145.0
akt creations,234820.0
albert pang transport,280800.0
alc technologies pte ltd,431000.0
alcotrad pte. ltd.,366350.0
alfa laval singapore pte ltd,654000.0
alfa tech vestasia pte. ltd.,2123921.5
algreat sales & services sdn. bhd.,5539.85
align sma pte. ltd.,556196.6799999999
alkalom eclat,263500.0
alkalom eclat pte. ltd.,123810.5
all construction engineering pte. ltd.,165000.0
all defence technology pte. ltd.,120123.01
all eights (singapore) private limited,564238.0
all link(21) engineering pte ltd,6250000.0
"all real technology co., ltd",406619.2
all-best photocopy & printing,136654.34
allan defence technologies pte. ltd.,195180.0
allen & gledhill llp,149477.0
alliance consulting engineers pte. ltd.,8387342.0
allied moving services (s) pte. ltd.,242450.0
allied transmissions (s.e.a.) pte ltd,1193300.0
allied universal security service,268404.71
"allied universal security, llc",284246.16
allison+partners singapore pte. ltd.,81600.0
allmaster enterprise,4818107.1
alniff industries pte ltd,573150.0
alpha analytical (s) pte ltd,3439183.0
alpha media pte ltd,68.0
alpha pioneer marketing pte ltd,21439.5
alpha products and systems pte ltd,1511135.0
alphine builders pte. ltd.,0.0
als technichem (singapore) pte ltd,628468.0
alsale holdings pte. ltd,98660.0
alsco pte. ltd.,92097.0
alsoknownas pte. ltd.,1144050.0
alstern technologies singapore pte. ltd.,3056800.0
alto construction and engineering services pte. ltd.,186500.0
altrus pte ltd,3418561.0
altus facilities engineering pte. ltd.,1147800.0
always 3ree pte. ltd.,1110661.0
alx private limited,236490.0
amazing explorer pte. ltd.,170890.0
amcon integration llp,268986.0
amdon consulting pte ltd,301250.0
amico technology international pte. ltd.,926087.8
amicus engineering pte ltd,969497.28
amitie international pte. ltd.,1896943.78
amnet technology pte ltd,64430.0
amobee group pte. ltd.,1260030.0
amphiro ag,805800.0
an academy pte. ltd.,270220.0
anacle systems limited,1682768.0
analytical technologies pte ltd,4221222.5
anavantage management consultancy llp,174800.0
ancell enterprise pte ltd,50102.25
anchorage construction co pte ltd,3395600.0
ancon anda pte. ltd.,11800000.0
andes appraisal pte. ltd.,288000.0
andritz singapore pte. ltd.,5788670.0
android builder pte. ltd.,379000.0
anexus pte. ltd.,1977721.0000000002
ang & ong consultants pte. ltd.,5722300.0
ang cheng guan construction pte ltd,22900000.0
ang kuah trading company,388003.5
animagine pte ltd,914250.0
anmani general construction pte. ltd.,4480000.0
anne leong hrd consulting,1268274.0
annesing pte. ltd.,253000.0
anonymous production,105500.0
anritsu pte ltd,54728.0
ansac technology (s) pte ltd,2120912.0
ansell protective solutions singapore pte. ltd.,1537200.0
antara koh private limited,9022841.0
antarius is pte. ltd.,81800.0
ante office pte. ltd.,520899.0
antechnic engineering pte ltd,45.68
anthology pte. ltd.,1005576.95
anticimex pest management pte. ltd.,497840.0
anton paar singapore pte. ltd.,398957.2
antzworkz consultants pte. ltd.,183000.0
aon hewitt singapore pte. ltd.,1142151.0
apba pte. ltd.,1152121.96
ape works pte. ltd.,886781.5
apex projects pte. ltd.,688000.0
apex sealing technologies pte. ltd.,300000.0
apex tennis,51200.0
apf construction pte. ltd.,2514839.0
aphesys networks pte. ltd.,216673.5
apkim resources,568560.0
aplusi asia pte. ltd.,93538.0
app systems services pte. ltd.,888740.03
apparel empire,163051.0
applied accounting solutions private limited,3460.0
apptitude pte. ltd.,203050.0
apro-asian protection pte ltd,2900680.0
aptitude management consulting pte. ltd.,167580.0
aquaforce private limited,718148.0
"aquarecycle, llc",236448.0
ar43 architects pte. ltd.,6.55
arachem (m) sdn. bhd.,63750.15
arbsolutions asia pte. ltd.,695700.0
arburg pte ltd,428751.0
arc sciences pte. ltd.,1059978.4
arcadis project management pte. ltd.,560004.2
arcadis singapore pte. ltd.,2270801.86
arch'lab pte. ltd.,154000.0
archi-theme partnership,4090.0
architects 61 private limited,23695893.88
architects project group llp,7.11
architects team 3 pte. ltd.,0.0
architects vista pte ltd,568507.96
archville architects,95590.0
ardent business advisory pte. ltd.,28000.0
ardent maritime singapore pte. ltd.,22050.5
aretese pte. ltd.,306380.0
arethos pte. ltd.,60000.0
argentra solutions pte. ltd.,248000.0
arina international holding pte. ltd.,457650.0
aris integrated medical pte. ltd.,184176.0
aristou pte. ltd.,848780.0
arkadin (singapore) pte. ltd.,0.6
arki-tech international pte ltd,125000.0
armstrong talent development,262500.0
arqon pte. ltd.,230000.0
arrowcrest technologies pte ltd,3207840.0
art glass solutions pte. ltd.,193380.0
art in bloom florist & gifts,85256.0
art loft llp,117600.0
art logica,890820.0
artex furnishings private limited,105427.0
arthur j. gallagher (singapore) pte. ltd.,16300.0
artistic expressions private limited,250400.0
artizen pte. ltd.,825580.0
arts wave,103230.0
arup singapore private limited,11851722.639999999
arup singapore private limited and aedas pte. ltd.,12288000.0
as-1 logistics pte. ltd.,369624.0
asa contracts pte. ltd.,14538770.0
asatsu-dk singapore pte. ltd.,244854.27
asc process systems limited,390541.0
ascendas services pte ltd,10850000.0
ascendo consulting pte. ltd.,86400.0
ascentia consulting pte. ltd.,203432.74
ascentiq pte. ltd.,3233300.0
asec security events command pte. ltd.,80000.0
aseptec pte. ltd.,440359.07
asero worldwide ltd,585000.0
ashtree international pte. ltd.,1943869.0
asia city online singapore pte. ltd.,86911.0
asia georesearch agency corporation pte ltd,383726.0
asia innovations pte. ltd.,164980.0
asia integrated property services pte. ltd.,78000.0
asia intergrated engineering pte. ltd.,237300.0
asia masima pte. ltd.,398500.0
asia pacific air quality group pte. ltd.,420323.0
asia pr werkz pte. ltd.,1791790.0
asia projects engineering private limited,22744160.0
asiabuild construction pte. ltd.,25100000.0
asiabuild enterprises pte ltd,239800.0
asialink w pte. ltd,332641.2
asian detours pte. ltd.,67841.0
asiapac distribution pte ltd,10318255.92
asiasoft solutions pte. ltd.,167236.0
asiastar international consultancy pte. ltd.,440549.6
asiatel(s) pte ltd,521725.0
asiawerkz communications pte. ltd.,306788.0
asis technologies pte ltd,218420.0
ask m&e pte. ltd.,6244000.0
asl shipyard pte ltd,678215.0
asp print consultus pte. ltd.,122768.0
aspacio design associates pte ltd,6183866.0
aspen event planners pte. ltd.,295.0
aspen3 pte. ltd.,873260.0
aspeq limited,3397000.0
aspire badminton centre,66300.0
aspire! group pte. ltd.,636467.28
asr building & conservation pte. ltd.,378230.0
assa abloy entrance systems singapore pte. ltd.,61398.0
assa abloy singapore pte ltd,2241199.0
assalaamu'alaikum enterprise,52100.0
asset management consulting limited,1.0
"associated energy group, inc.",3.0
associated geotechnical services co. sdn bhd,47800.0
associated property consultants pte. ltd.,549737.5
association for early childhood educators (singapore),6293068.0
association of muslim professionals,63300.0
assurance partners llp,341437.5
assure safety pte. ltd.,130410.0
assurich industries pte ltd,36500.0
astech pte. ltd.,156000.0
asterand bioscience,39190.5
astrata group pte. ltd.,2292580.0
atelier tang (pte.) ltd.,6478693.2
athena concepts pte. ltd.,69995.0
atkins design engineering consultants pte. ltd.,385500.0
atl maintenance pte. ltd.,23860602.339999996
atlas consulting surveyors,751.0
atlas maintenance pte. ltd.,430000.0
atlas vending solutions pte. ltd.,0.35
atomz i! pte. ltd.,9265010.77
atos information technology (singapore) pte. ltd.,11296724.27
atria architects,4780.0
ats landscaping & construction pte ltd,3482225.0
ats traffic pte ltd,57611929.93
att systems (s'pore) pte ltd,31190379.28
att trafficomms pte. ltd.,198280.0
attain analytics group pte. ltd.,273778.0
attolight sa,2829125.65
audax visuals pte. ltd.,205700.0
audi singapore pte. ltd.,232266.0
audio resources pte ltd,171084.0
audit alliance llp,70326.8
auditime pte. ltd.,126300.0
august international pte. ltd.,1605600.0
aurecon singapore (pte.) ltd.,1137250.0
auric pacific engineering pte ltd,738560.0
auroratherapy,120.0
autism resource centre (singapore),938000.0
auto hangar (india) pvt ltd,92147.34
autodesk asia pte ltd,768796.8
automated micron assembly pte ltd,120660.0
automatic controls and instrumentation pte. ltd.,5937720.0
autus international pte ltd,617590.4
aux media group pte. ltd.,3120383.0
av links communications (asia) pte. ltd.,272319.7
av media pte ltd,1164265.0
av-science marketing pte ltd,1227040.0
av8 media pte ltd,134675.6
ava insurance brokers pte. ltd.,3700993.48
ava-chem industrial pte ltd,50400.0
available. pte. ltd.,201300.0
avanade asia pte ltd,1415467.18
avantus training private limited,67500.0
avemore pte ltd,52392.0
avenue engineering pte. ltd.,36000000.0
avepoint singapore pte. ltd.,14521156.29
aviva ltd,28315685.810000002
avivar audience communications pte. ltd.,86540.0
"avl sea & australia co., ltd.",1721060.0
avm engineering pte. ltd.,434310.0
avon cleaning services pte ltd,236714.79
avon technologies pte ltd,1388900.0
avt (s) pte ltd,4352190.4
avvery engineering pte. ltd.,34383.0
awa industrial pte. ltd.,782172.0
awe environmental systems pte ltd,419290.0
awp pte. ltd.,710200.0
awwa ltd.,82251.0
ax sports pte. ltd.,48000.0
axa insurance pte. ltd.,4657077.53
axa insurance singapore pte ltd,1978295.68
"axcelis technologies, pte. ltd.",103845.91
axentel technologies pte. ltd.,854996.8
axil scientific pte. ltd.,876484.0
"axion biosystems, inc.",200732.63
axs pte. ltd.,980000.0
axxel marketing pte ltd,41730049000.0
ay designs pte ltd,309850.0
az united pte. ltd.,476472.25
azaas pte. ltd.,500000.0
azbil singapore pte. ltd.,5183631.0
azendian solutions pte. ltd.,3046707.03
azeus systems limited,93000.0
aztech technologies pte. ltd.,7300000.0
azure pte. ltd.,979335.0
b barcelona consulting pte. ltd.,210000.0
b p tan registered surveyor,167393.0
b'arts int'l events pte. ltd.,8645.0
b. braun singapore pte ltd,441200.0
b.t. group pte. ltd.,937780.0
b.t. sports pte ltd,661700.0
b19 technologies pte. ltd.,67100000.0
b2k pet products pte. ltd.,102710.12
bachy soletanche singapore pte ltd-wai fong construction pte ltd joint venture,293858081.1
baizonn pte. ltd.,493320.0
bakels singapore (private) limited,410300.0
baker & mckenzie.wong & leow,63790.0
ballyhoo exhibitions & events pte. ltd.,383599.0
ban chon corporation & trading pte ltd,21209800.0
ban choon marketing pte ltd,158999.95
ban chuan trading & engineering pte ltd,643200.0
ban hock hin company private limited,1304064.0
ban nee chen pte. ltd.,228360.0
ban tiong soon contractor pte. ltd.,7411600.0
baron asia group pte. ltd.,295.8
barton bruce shaw pte. ltd.,0.0
basepower enterprises pty ltd,140129.92
bates singapore asia pte. ltd.,369334.0
bautec pacific pte. ltd.,83600.0
bazgym consultancy pte. ltd.,148684.0
bbdo singapore pte ltd,2797508.08
bcd engineering pte ltd,72830.0
bct technology pte. ltd.,227120.0
bdl group architects,8.5
bdo consultants pte. ltd.,310900.0
bdo llp,986420.0
bdrc asia pte. ltd.,52000.0
beacon consulting pte ltd,381280.0
beacon educational supplies pte ltd,5610.0
beau voix uniform,450197.0
bec consultants,147000.0
beca carter hollings & ferner (s.e.asia) pte ltd,776300.0
beckhoff automation pte. ltd.,129658.0
beckman coulter singapore pte. ltd.,7359046.0
bedok transport pte. ltd.,277980.0
bee kong electrical engineering pte ltd,4811312.0
bee teck international pte. ltd.,408600.0
beenet singapore pte ltd,4856675.93
behavioural insights (singapore) pte. ltd.,537550.0
"beijing balfour technology co., ltd.",140045.4
beijing hua chuang zhi yuan ke ji you xian gong si,89920.8
"beijing johnson controls co., ltd shanghai office",59643.6
beijing riskcontrol co ltd,679378.39
beijing yi kun yuan lin gong cheng you xian gong si,108352.08
bell & bow agency,164220.0
ben foods (s) pte ltd,21250.010000000002
ben productions,31360.0
benchmark technologies,143238.0
benco maritime pte. ltd.,256800.0
beng heng engineering pte ltd,2189000.0
beng siew construction pte ltd,782700.0
beng soon machinery services (singapore) pte ltd,1875001.0
benly construction company pte. ltd.,20500.0
bentley systems singapore pte ltd,430312.84
bentz jaz singapore pte ltd,343300.0
bepa consultant international,49653.0
bergen equipment pte. ltd.,344100.0
"bermello, ajamil & partners, inc.",399950.0
bes technology pte. ltd.,571438.0
besco building supplies (s.e.a.) pte. ltd.,6943508.0
bescon consulting engineers pte,361000.0
besley & pike (singapore) pte. ltd.,3.25
best chemical co (s) pte ltd,135000.0
bestlink auto pte ltd,60000.0
beth-el (asia pacific) pte. ltd.,600450.0
bevital as,180450.0
bexource pte. ltd.,660189.69
bgc group pte. ltd.,3678238.33
"bgi tech solutions (hongkong) co., limited",642670.7
bhatch architects,1998000.0
bhcc construction pte. ltd.,323273350.0
bhl construction pte. ltd.,1032000.0
bholat- safeguard company limited,289342.0
bian hin co. (singapore) private limited,3836669.0
bibi & baba private limited,227232.69999999998
big foot logistic pte ltd,2891576.0
bigtree pictures pte. ltd.,109950.0
binjai interior design pte ltd,1261058.0
bintai kindenko pte ltd,144747342.8
bio laboratories pte ltd,1683600.25
bio-flora (singapore) pte. ltd.,53642.0
bio-rad laboratories (singapore) pte ltd,3300278.0
bio-rev pte. ltd.,36517.83
biomed diagnostics pte ltd,3711710.14
biomedix singapore pte. ltd.,1626557.5
biomerieux singapore pte. ltd.,21712.0
biscuit box,207500.0
biz@dpcloud pte. ltd.,14854.0
bizlink centre singapore ltd,442872.6
black & veatch (sea) pte. ltd.,114831800.0
black canvas llp,150000.0
black design pte. ltd.,1080359.0
blackblue media group pte. ltd.,1203071.7
blackbox research pte ltd,1883086.0
blackrock (singapore) limited,473000.0
blade club,18000.0
bloom consulting services pte. ltd.,59000.0
bloomberg finance l.p.,69541.82
blue dot learning pte. ltd.,126560.0
blue lake consultancy services,419680.0
blue ocean harvest pte. ltd.,221140.0
blue orange pte ltd,736238.0
blue speed construction pte ltd,97000.0
bluefors cryogenics oy,2282606.74
blueocean memtech pte. ltd.,254600.0
bluesg pte. ltd.,1300000.0
bluestone corporation pte ltd,454000.0
bluetel networks pte. ltd.,1752000.0
blugraph technologies pte. ltd.,498814.0
bm building pte ltd,208746.0
bms contractors pte ltd,459317.0
bms engineering and trading pte. ltd.,1537080.0
bms engineers pte ltd,14330.0
bmt asia pacific pte ltd,173550.0
bnf engineering (s) pte ltd,16790750.0
bnl services pte ltd,19237503.36
bnl waste management pte. ltd.,85400.0
bnp paribas securities services,3.9
bok kok chuan,114000.0
bolsen marine systems pte. ltd.,39520.0
boon guan construction pte ltd,8145710.0
boon poh refuse disposal pte. ltd.,722730.0
boon wee const (s) pte. ltd.,1736038.0
boon yong electrical pte ltd,310440.0
borneo air-conditioning & engineering,534900.0
borneo motors (singapore) pte. ltd.,5205388.590000001
bosch rexroth pte ltd,370000.0
bossa nova technologies llc,383500.0
bourgeois enterprise,950680.0
brainshake oy,122480.0
brand courage pte. ltd.,357230.0
brickston transport service,134400.0
brilliant corp (s) pte. ltd.,217047.4
brilliant general building construction pte ltd,3702210.74
brinda's pte ltd,15824.0
brio construction & engineering pte. ltd.,1670127.8599999999
briq pte. ltd.,188028.0
british council (singapore) limited,880680.0
brk international pte. ltd.,641808.0
broadcast communications international pte. ltd.,229328.0
broadcast engineering services pte ltd,2708500.0
broadcast professional pte. ltd.,3821491.33
bronjo medi,1431409.31
brooklyn-media private limited,125220.0
"brown & brown of garden city, inc.",470565.73000000004
bruker singapore pte. ltd.,20723085.67
brunswick group pte. limited,143000.0
bryan boiler engineering pte ltd,11389267.0
bsg landscape & construction pte. ltd.,19638331.07
bsi (1990) pte. ltd.,12470000.0
bt global services technologies pte. ltd.,1099980.0
bt global solutions pte. ltd.,1104618.37
bt&tan transport pte. ltd.,1231245.6
btw technology pte ltd,1168711.24
buchi singapore pte. ltd.,82900.0
build-max construction pte ltd,299035.0
build-up moulding & machining,300000.0
builder 90 pte ltd,46112778.0
builder max-jm pte. ltd.,1243800.0
builders 72 pte. ltd.,2067750.0
buildforms construction (pte.) ltd.,0.0
building construction co. (private) limited,33970840.0
buildwerkz builders pte. ltd.,430247.19
built force construction pte ltd,9328800.0
built pty ltd,378265.67
bulls-eye security services pte. ltd.,115200.0
bureau pte. ltd.,110000.0
bureauserve pte ltd,10885936.0
burning glass international inc.,890548.0
burson-marsteller (s.e.a.) pte. ltd.,627600.0
bus-plus services pte ltd,421944.0
busads pte ltd,1270145.0
business continuity planning asia pte. ltd.,39100.0
business edge personnel services pte ltd,7752757.4
bw furniture pte. ltd.,87768.0
bynder b.v.,186148.46
byzoro networks ltd.,339540.0
c & h properties pte ltd,1.0
c & p rent-a-car (pte.) ltd.,3102910.0
c k t thomas private limited,23137886.0
c&r interiors pte. ltd.,3337899.0
c&w services (s) pte. ltd.,98359551.65999998
c&w services operations pte. ltd.,1548259.0
c. melchers gmbh & co singapore branch,130374.0
c.k. toh construction pte. ltd.,161600.0
c.p.ong construction pte ltd,9710703.0
c2 creative communications pte. ltd.,8165961.61
c@nspecs pte. ltd.,1725451.94
ca facilities pte. ltd.,8262623.17
ca m&e engineering pte. ltd.,15610157.73
caa international limited,101177.0
cabcharge asia pte ltd,0.05
cable care pte. ltd.,3483620.8
