supplier_name,awarded_amt
evantek pte ltd,224713.0
events master (glc) pte. ltd.,269478.0
events people inc pte ltd,1398110.0
ever san construction pte ltd,7353000.0
evergreen engineering & construction pte ltd,4036300.0
"evergreen international nz, llc",469575.92
everpaint enterprise pte ltd,1533415.0
everteam pte. ltd.,1445.0
evico magnetics gmbh,249831.36
evo communications,63400.0
ewci pte. ltd.,43000.0
ewerkz projects,366372.96
ex libris ltd.,144983.88
exalit pte. ltd.,115600.0
excel precast pte ltd,13225630.0
excellent security & safety pte ltd,14284710.0
exceltec property management pte ltd,4591829.0
exclusive design construction pte ltd,3488272.0
executive counselling and training academy pte. ltd.,1787600.0
exer-fit consultancy services,451680.0
exercise & sports programming network,195800.0
exile solutions pte. ltd.,48000.0
exotissimo travel (singapore) co. pte. ltd.,283675.82
expand construction pte ltd,417521360.0
expandore electronics pte. ltd.,199950.0
experience matters pte. ltd.,1155339.0
experiential creations pte. ltd.,281608.0
expertise technologies pte ltd,3466492.5
explora pte. ltd.,456360.0
exponent challenge technology asia pte. ltd.,776800.0
export house (singapore) pte. ltd.,149500.0
express pest solutions pte. ltd.,270588.0
express point engineering & services pte. ltd.,399638.24
extrad instrumentation pte ltd,2897049.0
extrude hone k.k.,499998.0
eye-2-eye communications private limited,2525094.0
ez-link pte ltd,1838107.3199999998
ezra architects,252000.0
ezra print & pack pte ltd,767868.0
ezzogenics pte. ltd.,61322.0
f&h empire machinery sdn bhd,2946006.68
f1 recreation pte. ltd.,726170.2
fabristeel private limited,2869161.56
factiva limited,639619.0
fadeev security profi llc,179804.0
fadely enterprises & construction pte ltd,135288.0
faithful+gould pte. limited,939266.5
falcon epc pte. ltd.,903760.0
falcon incorporation pte. ltd.,12720185.55
familywise,488700.0
farm architects pte. ltd.,16.65
farmwork pte. ltd.,354500.0
fast forward thinking s.l.,323657.62
fcm singapore pte. ltd.,52813.0
fd chapman pte. ltd.,181000.0
federal fire engineering pte ltd,426000.0
fei company of usa (s.e.a.) pte ltd,841947.0
fei siong food management pte. ltd.,2688000.0
fei yue community services,7851358.64
felicity engineering pte ltd,7005892.71
felix investments & trading pte. ltd.,544850.0
feng ming construction pte ltd,29936609.0
feng ming construction pte ltd / t.y.lin international pte. ltd.,49240630.0
fermax asia pacific pte. ltd.,97800.0
fervour pte. ltd.,158400.0
festival square circle pte ltd,3250000.0
festo private limited,1166917.0
ffurious pte. ltd.,131320.0
fg concepts private limited,1157100.0
fibrecom systems pte ltd,76528.0
fibrwrap construction pte. ltd.,3719579.8
fico pte. ltd.,643500.0
field catering & supplies pte ltd,7.6
fieldmen general services corp.,83338.83
fieldtec engineering sdn. bhd.,108313.38
fillipace engineering,47600.0
filos community services ltd,117400.0
fire armour pte. ltd.,1830669.0
fire fighting systems (far east) pte. ltd.,15006500.0
fireball securitas & consultants pvt. ltd.,342238.97
firefly photography pte. ltd.,5386.5
firetronics private limited,70200.0
first economics pte. limited,112000.0
first state investments (singapore),2.0
first wave pte. ltd.,3932665.3
fischer instrumentation (s) pte ltd,125000.0
fisher assoc. ltd,1299957.37
fisher scientific pte ltd,5339414.38
fit transport systems pte. ltd.,92400.0
fitness core-ner pte. ltd.,607158.0
"fjc security services, inc.",121624.81
flame spray technologies pte. ltd.,722988.0
flare dynamics pte. ltd.,4077293.5
flat world technologies international pte. ltd.,254342.0
flava design llp,172500.0
fleishman-hillard,452323.16
fleishman-hillard inc.,958573.8
flexim instruments asia pte. ltd.,90388.32
flexisolve technology pte ltd,1093628.0
flexspeed technology pte ltd,2288925.0
flotech controls pte ltd,10183068.0
focal investigation & security agency pte ltd,136120.0
focus adventure pte. ltd.,321760.0
focus publishing ltd,807557.0
focus science technology services pte. ltd.,78000.0
foliage landscape services sdn bhd,98631.0
foma architects llp,90000.0
fonda global engineering pte. ltd.,59692741.879999995
fondaco pte ltd,4504860.0
fong consult pte. ltd.,25655342.0
fong yue development pte. ltd.,1166000.0
fongsoon engineering (s) pte ltd.,2055555.0
foo kon tan llp,1098000.0
food & nutrition specialists pte ltd,1400390.0
food haven the restaurant pte. ltd.,269500.0
foodxervices inc. pte. ltd.,720000.0
foong ah weng construction pte ltd,4698000.0
forbes research pte ltd,1507163.0
force 21 equipment pte ltd,5851453.199999999
formel engineering sdn. bhd.,71530.83
forms n shapes pte. ltd.,84080.0
formul8 pte ltd,4277629.1
formwerkz architects llp,535833.51
fortiz power engineering pte ltd,100920.0
fortune travel pte ltd,1618823.0
forum architects pte. ltd.,8489980.36
fosta pte. ltd.,28735612.5
fostre catering pte. ltd.,416719.0
foton motor auv (singapore) pte. ltd.,113099.0
foundation communications pte. ltd.,685545.02
four seasons hotel singapore,394611.0
four squares llc,408294.0
fpt asia pacific pte. ltd.,4336654.0
frank anthony wolak,400.0
freeman pte. ltd.,3795292.55
freight links express archivers pte ltd,202145.0
freight links logistics pte. ltd.,368578.0
fresh laundry pte. ltd.,77534.0
frontbuild engineering & construction pte ltd,32590000.0
frontier economics pty ltd,1858474.0
frontline security pte. ltd.,11190700.0
frost & sullivan (singapore) pte ltd,2675372.0
ftd solutions pte ltd,180286.08
fucom construction pte. ltd.,15162319.71
fuelfor pte. ltd.,197000.0
fugro global environmental and ocean sciences pte ltd,1911000.0
fuji signcrafts industries pte ltd,2215927.0
fuji xerox singapore pte ltd,20278540.94
fujian chengjian construction corporation limited (singapore branch),54860000.0
fujitec singapore corporation ltd,44719580.0
fujitsu asia pte ltd,101837597.35
full dome pro. company limited,137000.0
full house building construction pte. ltd.,7389876.0
fullerton fund management company ltd,480000.0
fullerton healthcare group pte. limited,1816260.0
furama riverfront singapore,274394.44
furmat construction pte ltd,5178378.0
fusen development pte ltd,3423860.0
future interior asia pte. ltd.,2543206.1
future-moves group pte. ltd.,359500.0
future-proof software pte. ltd.,415925.0
fxmedia internet pte. ltd.,1422020.0
fyh integrated pte. ltd.,4981743.0
g & c general contractors pte ltd,4501200.0
g - energy global pte. ltd.,454000.0
g element pte ltd,399000.0
g-cube engineering pte. ltd.,841335.0
g.a.c. enterprise,115200.0
g.p . wild (international) limited,115367.0
g.t.h. engineering & construction pte ltd,16076321.0
g2w mobile cleaning llp,1891137.6
g4s holding inc,595403.31
g4s secure solutions,142763.0
g4s secure solutions (singapore) pte. ltd.,12100279.0
gaia science pte. ltd.,1782687.0
galea sms consortium,333505.0
gallagher & associates asia pte. ltd.,518476.0
gallant events pte. ltd.,70200.0
gamlite it (s) pte. ltd.,1168500.0
gammon pte. limited,71264800.0
gan hup lee (1999) pte ltd,1955500.0
garden works pte. ltd.,844945.0
gardens by the bay,104840.0
gartner advisory (singapore) pte ltd,6331820.0
gates pcm construction ltd.,11990980.98
gates pcm integrated services pte. ltd.,8611840.7
gateway law corporation,388657.28
gattie-tan soo jin management consultants pte ltd,1.0
gaz inflatables & logistics asia pte. ltd.,170710.0
gcs machinery pte. ltd.,74000.0
gds engineering pte ltd,16610809.31
ge betz singapore pte ltd,2.5
ge energy (singapore) pte ltd,1469037.0
ge healthcare pte. ltd.,8346386.4799999995
gea westfalia separator (s.e.a.) pte. ltd.,6360000.0
gear fitters pte. ltd.,175195.0
gee sheng machinery & engineering pte ltd,617850.0
gees marketing pte. ltd.,1210003.05
geetha a & associates,450000.0
gemalto pte. ltd.,1049950.0
generation concept pte. ltd.,134502.9
genesis networks pte ltd,1686570.55
genetron engineering corporation (private) limited,124500.0
"genewiz, inc.",122240.0
genisys integrated engineers pte ltd,11668000.0
gennal industries pte ltd,144765673.7
genomax technologies pte. ltd.,261912.0
genome architects,158400.0
genplus pte. ltd.,169600.0
geoalliance consultants pte. ltd.,23153240.0
geoapplication engineers pte. ltd.,15477826.6
geoauto pte. ltd.,78000.0
geoicon pte. ltd.,404250.01
geomil equipment b.v.,764500.0
geomotion (singapore) pte. ltd.,8164105.5
geonamics (s) pte ltd,222085.0
geophysical services singapore pte. ltd.,155000.0
george kent international pte. ltd.,5110994.5
geoscan pte ltd,95500.0
geosmart international pte. ltd.,21088073.0
germs digital pte. ltd.,409800.0
gerstel llp,374451.0
getinge singapore pte. ltd.,5947605.0
gf machining solutions pte. ltd.,278300.0
gfg asia pacific pte. ltd.,3586182.14
gfk asia pte ltd,41395107.18
giesecke & devrient asia pte ltd,2489000.0
gigatech engineering sdn bhd,105325.92
gim tian civil engineering pte ltd,51928770.0
gimi international pte. ltd.,1988811.0
gims & associates pte. ltd.,0.0
gimtronic engineers pte. ltd.,1692295.0
gingel international (pte.) limited,89440.0
glass@worx pte. ltd.,1144400.0
gleason advertising pte ltd,9501100.0
glen-bromac (s) pte ltd,336718.0
glenn jude nosworthy,161000.0
gliderol doors (s) pte ltd,690400.0
glints intern pte. ltd.,124290.0
global engineering creators pte. ltd.,158100.0
global international travel pte. ltd.,199574.0
global lingo (s) pte. ltd.,14750.0
global maritime & port services pte ltd,4662460.0
global mascot pte. ltd.,506000.0
"global modeling and simulation technologies, inc.",166168.97
global search partners pte. ltd.,60000.0
global sinotrust pte. ltd.,252264.0
global specialised services pte. ltd.,188718.94
global tax free pte. ltd.,14489784.39
global travel experts pte. ltd.,210279.0
global travel pte ltd,1153758.02
globalsign.in pte. ltd.,1065714.32
globalwide international pte. ltd.,8344300.0
globotron (s) pte. ltd.,2995238.0
glorious (s) pte. ltd.,1945250.0
gm engineering pte. ltd.,84.8
gnt builders pte. ltd.,294545.0
godrej (singapore) private limited,12720.0
goh & foong contractors pte ltd,5022661.0
goh eu joe,12100.0
goh seow heong mervyn,18360.0
goh sin guan huat pte ltd,38430000.0
goh tong heng engineering pte ltd,738723.0
goindustry dovebid (s) pte. ltd,326780.0
gold touch pte. ltd.,266031.0
goldbell car rental pte. ltd.,337680.0
goldbell engineering pte ltd,198000.0
goldcastle international pte ltd,4392311.0
golden landscape & construction pte. ltd.,357680.0
"golden rose nursery & landscape co., ltd.",133743.3
golden travel services pte ltd,3535208.0
golden village pictures pte ltd,670780.0
golder associates (singapore) pte ltd,98400.0
golin/harris international pte limited,464000.0
goodfellas consultancy pte. ltd.,4442307.05
gosh advertising pte ltd,609238.31
gp wangsa engineering,46856.89
gpa guardian protection sa,1702777.92
gps lands (singapore) pte ltd,279090.0
grace management & consultancy services pte. ltd.,199800.0
grand build interior pte. ltd.,156880.0
grand copthorne waterfront hotel singapore,421761.0
grandbuild construction pte ltd,13448000.0
grant associates singapore pte. ltd.,2989894.71
grant thornton singapore private limited,168500.0
graphene industries limited,211317.2
graphic masters & advertising pte ltd,231823.0
great art design & build pte. ltd.,83995.0
great eastern general insurance limited,1.0
greatearth corporation pte. ltd.,96386000.0
green forest landscape pte. ltd.,22201731.75
green house design & communications pte. ltd.,310937.0
green koncepts pte. ltd.,160000.0
green pastures psychological practice for children and youths,113450.0
green tropic products pte ltd,1710047.0
greencity pest management pte. ltd.,155180.0
greenmark construction pte. ltd.,1073652.48
greensafe international pte. ltd.,774727.0
greenspan singapore private limited,108032.2
greenwave solutions pte. ltd.,7212000.0
greenwich associates singapore pte. ltd.,99000.0
grenzone pte. ltd.,51736.0
grey group pte. ltd.,1297785.3599999999
grid communications pte. ltd.,437417.6
grid private limited,558900.0
ground instrumentation & engineering pte. ltd.,16693623.0
groupe seb singapore pte. ltd.,2250632.8
groupm media products pte. ltd.,28963201.25
groupm singapore pte. ltd.,12523283.0
"grovo learning, inc.",63013.3
growthland pte ltd,0.0
gs engineering & construction corp.,2416723964.0
gsmprjct creation pte. ltd.,97360.0
"gsn property services co., ltd.",1100854.83
gt industrial pte ltd,150000.0
gtk construction sdn. bhd.,203918.4
guan ho construction co (pte) ltd,178337412.0
guan joo construction pte ltd,12988000.0
guan lee heng contractor pte ltd,338400.0
guardian health & beauty,67200.0
guerilla media private limited,211200.0
gunung construction & engineering pte. ltd.,8137000.0
guthrie engineering (s) pte ltd,307549046.26
"guthrie engineering (s) pte ltd / lsis co., ltd. consortium",99500000.0
guthrie fmc pte. ltd.,20801931.5
gwc consulting pte. ltd.,41458500.0
gwtech engineering pte. ltd.,1255800.0
gyro communications pte. ltd.,938100.0
h c lim consultants,256600.0
h fifty five,237000.0
h p construction & engineering pte ltd,122734497.0
h.a.m. creations pte. ltd.,382105.0
h.r.strategies pte. ltd.,150000.0
h2 hub pte. ltd.,343530.0
hai leng contract pte ltd,985400.0
hai-ou co. (s) pte. ltd.,1563633.01
haig construction management limited,2802460.17
hainei building & development (s) pte ltd,360828.0
haix-schuhe produktions- und vertriebs gmbh,1090334.12
hak kian enterprise pte ltd,8319860.0
hak long engineering pte ltd,153950.0
hakuhodo inc.,1467783.52
hamilton & sherwind pte. ltd.,215862.5
hancom gmd inc.,69800.0
handsonlearning strategies llp,231000.0
hao da pte ltd,5739088.0
happy table productions pte. ltd.,133160.0
harford engineering pte ltd,23012643.0
harijanto vanessa dewi,68980.0
harilela hotels (singapore) pte ltd,85350.0
harvest consulting engineers llp,424000.0
harvest link international pte ltd,159763.9
hashmeta pte. ltd.,84000.0
hashtag interactive pte. ltd.,701370.0
haskoningdhv nederland b.v.,569000.0
havas media asia pacific pte. ltd.,361500.0
hawker management pte. ltd.,3335580.0
hbb engineering pte. ltd.,1182700.0
hc cleaning services sdn bhd,276428.0
hcj construction pte. ltd.,48101500.0
hcl insys pte. ltd.,1243000.0
hcl singapore pte. ltd.,24779292.490000002
hd contractor pte. ltd.,531706.0
healthway medical group pte ltd,2578500.0
heinen & hopman engineering singapore pte. ltd.,1945588.0
helix media pte. ltd.,220200.0
hello stranger pte. ltd.,267280.0
helmholtz-zentrum berlin fur materialien und energie gmbh,162340.0
helu-trans (s) private limited,146505.85
henderson security services pte. ltd.,100800.0
henko machine tools pte. ltd.,112670.0
hetech solutions pte. ltd.,24510.0
hettich asia pacific pte. ltd.,211288.41
heulab pte. ltd.,805912.0
hew transportation pte. ltd.,83088.0
hewlett-packard singapore (sales) pte. ltd.,6109602.82
hexa pro services pte ltd,1073400.0
hexamine sdn bhd (singapore branch),4297205.0
hexcel solutions pte. ltd.,4186828.0
hexogon solution pte. ltd.,7519028.6
hgh systemes infrarouges,1099000.0
hi-point engineering pte ltd,2587857.1
hi-tech instruments pte ltd,1182358.0
hi-tech instruments sdn bhd,1390175.0
hi-tek construction pte ltd,256615000.0
hiap engineering & construction pte ltd,1195200.0
hiap shing construction pte. ltd.,5507800.0
hiden analytical limited,182692.0
hiend software pte. ltd.,935000.0
high achievers outdoor consultants pte. ltd.,271589.0
high end communications pte ltd,2108232.5
highness electrical engineering pte ltd,1143145.6
highway international private limited,6893561.0
hiladt architects llp,1000000.0
hill & knowlton (sea) pte ltd,1371120.0
hilton singapore,101772.0
hitachi aqua-tech engineering pte. ltd.,588440.0
hitachi asia ltd.,1185480.0
hitachi consulting singapore pte. ltd,9854010.0
hitachi data systems pte limited,3608828.92
hitachi elevator asia pte. ltd.,11756896.0
"hitachi plant services co., ltd.",203200.0
hitachi systems digital services (singapore) pte. ltd.,6969040.6
hitech engineering,0.0
hivelocity pte. ltd.,622020.0
hjgher,352489.7
hjw builders pte. ltd.,1590317.0
hks surveyors pte ltd,1201.0
hl suntek insurance brokers pte. ltd.,215254.72
hmc group pte. ltd.,449398.0
hmi institute of health sciences (holdings) pte. ltd.,48400.0
ho choon transport & construction pte ltd,440000.0
ho eng huat construction pte ltd,22902271.3
ho lee construction pte ltd,87300000.0
hobee print pte ltd,323410.0
hock guan cheong builder pte ltd,154100168.0
hock hai civil engineering & building pte ltd,32052800.0
hock lian seng infrastructure pte. ltd.,137380000.0
hocklim engineering pte. ltd.,2501150.0
hoe ann granite industrial construction,1337077.0
hogarth & ogilvy,680230.0
holiday inn resort batam,295445.0
hollysys (asia pacific) pte. ltd.,250000.0
home-fix d.i.y. pte ltd,699300.0
homewood design & management,1074791.0
hon builder pte. ltd.,7974120.0
hon industries pte. ltd.,172979216.0
honav singapore pte. ltd.,818400.0
honeycombers pte. ltd.,768818.88
honeywell (tianjin) co ltd,71181.0
"honeywell analytics asia pacific co., ltd.",972736.11
honeywell pte ltd,3231914.0
hong an engineering pte. ltd.,526342.0
hong heng industries private limited,167.6
hong hill pte. ltd.,19.28
hong jun construction pte. ltd.,1514250.0
hong kong tat kee tailor,647450.0
hong lam engineering pte ltd,2033473.0
hong seng sports surfaces pte. ltd.,494238.0
hong shin builders pte ltd,58096721.0
hong sing co. (pte) ltd.,185000.0
hong union builder pte. ltd.,728617.0
hong wei global pte. ltd.,159500.0
hook plumbing works,64116.0
hope first response pte. ltd.,642976.0
hope technik pte. ltd.,30257842.0
horiba instruments (singapore) pte ltd,200000.0
horizon contracts pte. ltd.,189000.0
horti-flora services pte ltd,1570500.0
hortian llp,156050.0
horwath asia pacific (singapore) pte ltd,75600.0
hosing engineering and development pte. ltd.,387000.0
hotel miramar (singapore) limited,167603.1
houghton kneale design limited,239040.0
how jasen,101500.0
howden insurance brokers (s.) pte. limited,965974.68
hoya mask singapore,197409.58
hoyi system pte. ltd.,1158968.8599999999
hp coating pte ltd,4177620.0
hp pps singapore (sales) pte. ltd.,86000.0
hpc builders pte. ltd.,104868619.0
hpc hamburg port consulting gmbh,202000.0
hph engineering pte ltd,1680000.0
hs e&c pte. ltd.,32269000.0
hs engineering consultants,5154000.0
hs international pte. ltd.,320000.0
hsauto furnishing pte. ltd.,197900.0
hsc pipeline engineering pte ltd,20988000.0
hsl constructor pte ltd,648684750.0
htm medico pte. ltd.,3966368.01
hua chang construction pte. ltd.,2770400.0
hua hng trading co pte. ltd.,562414.0
huason construction pte ltd,273702.0
huationg contractor pte ltd,124334529.0
hudson global resources (singapore) pte. ltd.,1192400.0
human resources & management systems consulting asia pacific pte. ltd.,508950.0
"hunan fengtian construction group co., ltd. singapore branch",37996725.21
hup chung tentage system pte. ltd.,6156164.7
hup seng furnishing & construction pte. ltd.,866214.0
hur solutions pte. ltd.,499884.0
hwa aik engineering pte. ltd.,1244450.0
hwa seng builder pte ltd,313614400.0
hwa seng builder pte ltd / jyc consultancy pte ltd,13372000.0
hwee jan (s) pte ltd,731032.05
hwee mene building construction pte. ltd.,1835326.0
hydac technology pte ltd,88000.0
hydro aquatic pte. ltd.,1797387.2
hydroinformatics institute pte. ltd.,2954974.7199999997
hydrosphere singapore pte. ltd.,320918.8
hyla architects,63168.79
hyrax pte. ltd.,579579.15
hytech builders pte ltd,128249966.0
hyundai engineering & construction co. ltd,703151000.0
i switch pte. ltd.,27.8
i-access solutions pte. ltd.,1122885.0
i-logic concepts pte. ltd.,103626.92
i-magination solution pte. ltd.,11262102.0
i-promo pte. ltd.,4863527.5
i-unity builders pte. ltd.,1457800.0
i.em engineering consultants pte. ltd.,420000.0
i.m communications pte. ltd.,4413737.05
i.z. plastics & supplies pte. ltd.,1026957.6
i2 pte. ltd.,63000.0
i_possible pte. ltd.,46266.0
ianz new zealand quality college,143341.0
iba international (s) pte. ltd.,121362.5
ibase technology private limited,877200.0
ibc asia (s) pte ltd,335055.0
ibm singapore pte ltd,4595682.09
iceberg design pte. ltd.,465490.0
icf consulting services hong kong limited,599108.0
icon resources and technologies pte ltd,54000.0
ics multimedia pty ltd,424000.0
id.inc interiors pte ltd,5846809.0
id21 pte. ltd.,1616885.0
idas technology private limited,50000.0
idea konzepte construction pte. ltd.,364821.2
ideal memories pte. ltd.,52800.0
ideal systems (singapore) pte. ltd.,586465.0
idemia singapore pte. ltd.,33383023.91
identiv pte. ltd.,633532.2
idi laser services pte ltd,2732600.0
ids medical systems (singapore) pte. ltd.,179851.80000000002
iesve singapore pte. ltd.,810000.0
ifacilities pte. ltd.,2034256.0
ig logistics pte. ltd.,4423.0
igine pte ltd,864158.0
igm services pte ltd,1804000.0
ignesis engineering pte. ltd.,847000.0
ih singapore pte. ltd.,905495.0
ihs global pte. ltd.,789652.0
iij global solutions singapore pte. ltd.,399000.0
ila group pte. ltd.,1476516.4
illumina singapore pte. ltd.,1874280.0
im space pte. ltd.,1042065.0
image creative design pte ltd,1470443.0
imc information multimedia communication ag,1673725.0
imcomp international pte ltd,243240.0
imcs construction pte. ltd.,1769456.0
imec technology pte ltd,226780.0
imgvision pte. ltd.,275670.0
impact! media monitoring llp,275400.0
"imperial hotel, ltd",137330.46000000002
imperium solutions pte ltd,1298918.3
imrb millward brown international pte ltd,1109080.0
ims mahajak pro audio pte. ltd.,585225.0
incall systems pte ltd,2059202.0
inchone pte. ltd.,125050.0
incorporated builders pte ltd,49610517.0
indat engineering pte. ltd.,2457800.0
indeco engineers (pte) ltd,213213461.98
independent project analysis private limited,125480.0
india international insurance pte ltd,314322.39
industrial & commercial security pte ltd,2724200.48
industrial & safety equipment (pte) ltd,81090.0
infield projects private limited,1.8
infinite frameworks pte limited,108300.0
infinitus law corporation,215000.0
infinity design and engineering pte. ltd.,535912.3
info access and distribution (hk) limited,419296.0
info lab pte. ltd.,96000.0
infohost pte ltd,40282.56
infonet systems and services pte ltd,181184.5
"ingenieria y economia del transporte, s.a.",174146.19
ingersoll-rand south east asia (private) limited,1478178.0
ingrid design pte ltd,461200.0
ink and pixel pte. ltd.,2.0
inkspire group llp,100650.0
inlingua school of languages pte. ltd.,62000.0
innoco oil pte ltd,147000.0
innocom technologies pte ltd,1601713.92
innoflex pte. ltd.,961127.2
innoheart pte. ltd.,348657.0
innolas solutions gmbh,2435000.0
innomed pte ltd,123500.0
innoplan technology pte ltd,1965600.0
innotrek pte. ltd.,283491.0
innova market insights b.v.,198000.0
innovative diagnostics private limited,1564850.0
inquiring dialogue pte. ltd.,135000.0
inresearch pte. ltd.,626975.0
inscape limited,97206.89
insert coin pte. ltd.,142072.5
insight technology solutions pte. ltd.,352834.45
insightmatrix,3525249.96
inspire joy,255145.0
institute of mental health,5167840.0
"institution of engineers singapore, the",140000.0
intage singapore pte. ltd.,381270.0
intec precision equipment pte ltd,3842528.9
integrated allied services pvt ltd,983623.95
integrated dna technologies pte. ltd.,850693.85
integrated health plans pte ltd,2221876.0
integrated learning systems pte ltd,19600.0
integrative learning corporation pte ltd,33975.0
intel technology asia pte ltd,869550.0
intensecomp pte. ltd.,1500000.0
interconsultants pte ltd,1036962.86
intercorp solutions pte ltd,3595006.0
interglow (s) pte. ltd.,624613.08
interhorizon corporation pte ltd,1275166.0
interlink power system pte ltd,149884.0
intermass fischer-asia pte ltd,133020.0
international bearings (pte) ltd.,174400.0
international catering pte ltd,112868.0
international paradise connexions tours & travels pte ltd,200040.0
international scientific (private) limited,69900.0
international sos pte ltd,972360.0
international typesetters pte ltd,90026.0
intersoftkk (singapore) pte. ltd.,72280.0
interswift moving and storage pte. ltd.,204102.0
intraix pte. ltd.,696000.0
intricon pte. ltd.,4079726.1
invogue biz pte. ltd.,2629432.1
inx events & productions pte. ltd.,2.0
ionicon analytik gesellschaft m.b.h,233500.0
iosys solutions pte. ltd.,263075.0
ipa singapore pte. ltd.,91776.0
ipav limited,1239602.02
ipg mediabrands (singapore) pte. ltd.,3084935.79
ips securex pte. ltd.,652943.01
ipsos pte. ltd.,8281940.0
iptec pte. ltd.,89900.0
iq dynamics pte ltd,177950.0
iq tennis,64000.0
iron mountain singapore pte. limited,305380.37
isentia brandtology pte. ltd.,990880.0
isentia pte. ltd.,162000.0
island recovery services,3299450.0
iso-team corporation pte ltd,22793921.0
isoteam c&p pte. ltd.,403901.0
isoteam green solutions pte. ltd.,1885758.95
ispl pte ltd,1480000.0
iss facility service sdn bhd,67034.28
iss facility services private limited,9645624.0
iss hydroculture pte. ltd.,150.0
iss security guarding co. ltd.,223102.46
it technologies pte ltd,1195906.5499999998
it-bio pte. ltd.,1017824.0
italmatic tyre & retreading equipment (asia) pte ltd,897740.28
itcan pte. limited,240000.0
itech vision pte ltd,32560.4
iterate pte ltd,346000.0
ithaca pte. ltd.,155400.0
ithera medical gmbh,81215.0
itlink business solutions (s) pte ltd,112268.35
ito security pte. ltd.,84741.8
itron metering systems singapore pte. ltd.,255500.0
its science & medical pte ltd,16581808.870000001
itt global learning pte. ltd.,266445.8
