supplier_name,awarded_amt
itw pte. ltd.,803160.0
ix technology pte. ltd.,119400.0
izen biosciences private limited,935200.0
izeno private limited,2715254.6
j k foo consortium pte ltd,0.0
j keart alliances pte. ltd.,2505887.5
j'kids amusement pte. ltd.,154724.5
j. m. pang & seah (pte) ltd,1434540.0
j. walter thompson (singapore) pte. ltd.,409306.5
j.p. electronics pte ltd,231000.0
ja engineering and trading pte. ltd.,172000.0
"jack rouse associates, inc.",151000.0
jacobs international consultants pte. ltd.,2051347.0
jadia logistics pte. ltd.,1246504.0
jaguar gas & engineering sdn. bhd.,35987.33
jaie group pte. ltd.,76320.0
jake enterprise pte ltd,72400.0
james aluminium design & contract pte ltd,202641.0
"jangho group co., ltd. singapore branch",37803429.730000004
"jani-king of washington d.c., inc.",483161.76
jardiflore sprl,167774.2
jardin enchante pte. ltd.,1080000.0
jardine lloyd thompson private limited,903258.81
jardine onesolution (2001) pte ltd,21669980.24
jas forwarding (singapore) pte. ltd.,34500.0
jasa investigation & security services pte ltd,5892210.0
jason electronics (pte) ltd,1087290.0
jb parade sdn.bhd.,301214.0
jb technical services,69600.0
"jc & associates communications, inc.",336177.0
jcp consultancy international limited,24900.0
jd acoustic pte. ltd.,177418.0
jd talents management & consultancy pte. ltd.,173300.0
jd union pte. ltd.,188046.0
jean luc charles lebrun,29023.0
jebsen & jessen technology (m) sdn. bhd.,71672.56
jebsen & jessen technology (s) pte. ltd.,3402590.88
jei fong engineering pte. ltd.,6759800.0
jel maintenance pte ltd,41893738.0
jensen asia pte ltd,185690.0
jeol asia pte. ltd.,14952227.0
jgp architecture (s) pte ltd,4.4
ji-hon development pte ltd,1442000.0
jia yi construction pte. ltd.,214200000.0
jib specialist consultants pte. ltd.,587100.0
jim coleman cadillac,90614.43
jin choon civil engineering pte. ltd.,61870900.0
jk technology pte ltd,396039.0
jk trudata solutions pte. ltd.,122264.86
jk59 transport pte. ltd.,707616.0
jmj distribution services pte ltd,75780.0
jms singapore pte ltd,1715667.25
jmz sports management,44100.0
jn engineering (private) limited,971942.0
jobstudio pte. ltd.,547777.52
joevent international,244190.0
john holland electrical & service pte ltd,2505832.0
john holland engineering pte ltd,243000.0
john holland pty ltd - zhen hua (singapore) engineering pte. ltd. joint venture,175741589.0
johnson controls (s) pte. ltd.,46594211.0
joint & y enterprise pte. ltd.,6967766.98
joint analytical systems (singapore) pte. ltd.,146664.0
jones lang lasalle property consultants pte ltd,220001.0
jos applications (s) pte. ltd.,129661.92
joshua research consultants pte. ltd.,330056.0
journeyful pte. ltd.,229673.5
journeys pte ltd,2530584.0
joyous se engineering,307050.0
jpkinstruments aktiengesellschaft (singapore branch),361950.0
jpl consultants pte. ltd.,450960.5
jpl wong & co,493000.0
jpn industrial trading pte ltd,279980.0
jpp far east (s) pte ltd,6878000.0
jpt electronics pte. ltd.,140000.0
js metal pte. ltd.,57824337.8
jupiter builder pte. ltd.,15710502.0
jurong consultants pte ltd/ atkins design engineering consultans pte. ltd./ surbana international consultants pte. ltd.,8955579.98
jurong districentre pte ltd,101376.0
jurong port pte ltd,1.0
jurutera omc,91580.0
jurutera uji tatah sdn. bhd.,29402.52
jusfeedback pte. ltd.,1845580.0
just simply gifts pte. ltd.,421300.0
justlogin pte ltd,127500.0
juzz web pte. ltd.,238640.0
jyc consultancy pte. ltd.,388800.0
k g catering pte. ltd.,280047.0
k h lee engineering & construction pte ltd,3577000.0
k l industries pte ltd,189475.2
k ratna sports pte. ltd.,50082.0
k&c protective technologies pte. ltd.,898000.0
k&h aviation pte. ltd.,1919500.0
k. a. fabric shutters pte. ltd.,620390.0
k. n. nursery (b) sdn bhd,172800.0
k.c. dat (singapore) private limited,577002.0
k.k. logistics,601092.1799999999
k11 security engineering pte. ltd.,163200.0
ka-tech asia pte. ltd.,250850.0
kaba security pte ltd,1170699.06
kadence international pte. ltd.,158886.0
kaffe esplanade,1351940.0
kaffee kultur,360360.0
kah engineering (1986) pte. ltd.,54566560.0
kaia architects,484000.0
kaimay trading pte. ltd.,5717056.0
kaiser foundation health plan of the mid atlantic states,522541.24
kajima overseas asia pte ltd,893965469.0
kandenko co ltd,920388.0
kang swee ann,388200.0
kantar media singapore pte. ltd.,447520.0
"kapteyn-murnane laboratories, inc.",963518.5
"kawasaki heavy industries, ltd. / csr qingdao sifang co., ltd. / kawasaki heavy industries (s) pte ltd consortium",136800000.0
kay lim construction & trading pte ltd,508500000.0
kay ngee tan architects,243016.9
kayakasia paddlesports pte. ltd.,13000.0
kb associates pte. ltd.,1296689.0
kc lau registered inspector,22800.0
kc security & investigation services pte. ltd.,209000.0
kcl consultants pte. ltd.,12000.0
keat seng piling pte. ltd.,12993828.0
kelly services (singapore) pte. ltd.,1556272.7999999998
kemet far east pte ltd,220540.0
kemsa (far east) pte ltd,118800.0
ken-pal (s) pte ltd,295677756.0
kenda (s) pte ltd,101128.2
kenetics innovations pte ltd,338886.0
keppel enterprise services pte. ltd.,231000.0
keppel infrastructure holdings pte. ltd.,1.08
keppel logistics pte ltd,2268462.0
kestrel investigation & security pte ltd,3619800.0
key editions pte ltd,1111060.0
keydence systems pte. ltd.,250000.0
keyence singapore pte ltd,158800.0
keysight technologies singapore (sales) pte. ltd.,2054501.0199999998
kh & hong pte ltd,1549304.0
kh security agency pte. ltd.,289200.0
khattarwong llp,26903.0
khian heng construction (private) limited,38190000.0
khl printing co. pte ltd,155822.8
khoon yan pte. ltd.,445000.0
kian hiap construction pte ltd,84397334.0
kiat lee landscape & building pte ltd,15299810.0
kib insurance brokers (s) pte ltd,766859.08
kienta engineering construction pte. ltd.,123098000.0
killem pest pte ltd,8488434.0
kilowatts engineering and construction pte ltd,157281182.0
kim bock contractor private limited,60129744.68
kim huat refrigeration and electrical pte ltd,1355540.0
kim seng heng engineering construction (pte) ltd,60601516.0
kim technology & systems engineering pte ltd,551110.0
kim tiong huat contractor pte ltd,11429625.0
kimaro geotechnical engineering pte. ltd.,1862476.0
kimly construction private limited,475546591.0
kin xin engineering pte ltd,7010000.0
kin yiap press pte ltd,65576.0
kindly construction & services pte. ltd.,1800000.0
king auto technologies & engineering pte. ltd.,636975.0
king content (sg) pte. ltd.,226607.5
king's build industrial pte ltd,195000.0
kingsmen exhibits pte ltd,19658669.0
kingsmen ooh-media pte. ltd.,2127873.86
kingsville pacific (since 1978) private limited,927485.0
"kingyoup optronics co., ltd.",1746672.56
kinlab pte. ltd.,70000.0
kinokuniya book stores of singapore pte ltd,413.0
kipp & zonen asia pacific pte. ltd.,459500.0
"kiso-jiban consultants co., ltd singapore branch",13518360.0
kistler instruments (pte) ltd,274487.0
kjs construction pte ltd,19033039.990000002
kk women's and children's hospital pte. ltd.,31200.0
kkt technology pte. ltd.,280000.0
klareco communications pte. ltd.,2241882.76
kleen wash laundry,3150.0
kloe sa,528738.31
knight frank property asset management pte. ltd.,14121311.4
knight frank pte ltd,165005.2
knight griffin pte. ltd.,151600.0
knolskape solutions pte. ltd.,36500.0
knowledge management solutions pte ltd,6420227.24
knt engineering & trading pte ltd,4102436.93
ko'ach consultants pte. ltd.,155000.0
ko'ach development pte. ltd.,2549400.0
kodak (singapore) pte. limited,4913311.89
kodak alaris singapore pte. ltd.,162771.0
koh brothers building & civil engineering contractor (pte.) ltd.,342950000.0
koh bus transport service,395140.0
koh contracts & services pte. ltd.,856720.0
koh eco engineering pte. ltd.,8370000.0
kohler singapore pte. ltd.,78620.0
kohup sports pte ltd,592770.0
koizumi lighting singapore pte. ltd.,23618291.67
kok tong construction pte ltd,7505000.0
kolon global corporation,16945158.0
komco engineering pte ltd,68592.0
komoco motors pte ltd,175000.0
kone pte ltd,23555378.4
"kong, lim & partners llp",530622.0
kongsberg maritime pte. ltd.,3968900.0
kongsberg norcontrol pte. ltd.,372438.0
konica minolta business solutions asia pte. ltd.,995870.0
koon construction & transport co. pte. ltd.,162578600.0
koon seng construction pte ltd,2980300.0
koraker construction pte. ltd.,49800.0
kordamentha pte. ltd.,3990160.0
korn ferry hay group pte. ltd.,7118025.0
korn/ferry international pte. ltd.,350000.0
kosh consulting group (asia) pte. ltd.,270500.0
kowa lab engineering pte. ltd.,166734.0
koyo engineering (s.e. asia) pte. ltd.,35749320.0
kpmg advisory services pte. ltd.,560000.0
kpmg llp,4694030.0
kpmg services pte. ltd.,31327005.310000002
kram electrical industries ltd,193037.64
krds digital pte. ltd.,277000.0
krishco singapore construction pte ltd,7343200.0
kruthwong & sprenger pte. ltd.,144052.0
ks partners engineering enterprise,122400.0
kt business (r) pte. ltd.,6540080.0
ktc civil engineering & construction pte ltd,896009108.0
ktp consultants pte ltd,2564100.0
kua harn wei,43163.0
kuan aik hong construction pte ltd,94492500.0
kumpulan protection sdn bhd,19440.0
kumudra landscape services pte. ltd.,69600.0
kunda consulting engineers,185000.0
kunyi (singapore) pte ltd,778992.0
kurihara kogyo co. ltd.,341000.0
kurita (singapore) pte. ltd.,1738002.05
kwan yong construction pte ltd,124950000.0
kwang sing engineering pte. ltd.,7879150.0
kwoh yap chuang,84000.0
kwok printers pte ltd,373888.0
kwong wai shiu hospital,1.0
kyo ei denko pte ltd,100000.0
kyoob - id pte. ltd.,463851.0
kyoob architects pte. ltd.,1647580.0
"l & k engineering co., ltd (singapore branch)",17568000.0
l&rui concept group pte. ltd.,5414877.8
l-meta engineering pte ltd,712500.0
l-pine design pte ltd,1684655.0
l. h. mgmt pte. ltd.,111800.0
l.c.h. construction & trading pte ltd,398700.0
lab science solution pte. ltd.,1879014.0
labivf asia pte. ltd.,157460.0
labman automation limited,996516.0
labotech pte ltd,197600.0
labquip (s) pte ltd,2324188.0
lac construction pte. ltd.,0.0
laerdal singapore pte ltd,225904.88
lagardere sports asia pte. ltd.,398500.01
lagoon events & entertainment pte ltd,72742.0
lai metals pte. ltd.,45360.0
lai pui san,9600.0
lai yew seng pte ltd,2705170.0
lai-bros air-cond. & electrical sdn. bhd.,62887.049999999996
lam chuan construction pte ltd,22060235.0
lam hwa engineering & trading pte ltd,4562052.3
lancer design pte ltd,283400.0
landscape engineering pte ltd,58468643.0
language works pte. ltd.,26600.0
langzauner gmbh,269950.05
lanspower services sdn. bhd.,29896.91
lantone systems pte. ltd.,65050.0
laser 21 pte ltd,5200355.67
latitude experience pte. limited,565392.72
laud architects pte ltd,2465006.5
lavision biotec gmbh,500000.0
lbd engineering pte. ltd.,218045255.0
lbe engineering pte. ltd.,496281.0
lc&t builder (1971) pte. ltd.,286516160.0
lce engineering pte ltd,911342.0
ldr pte. ltd.,404000.0
le tong resources pte. ltd.,17.28
leacon engineering pte. ltd.,570440.0
leads engineering (s) pte ltd,2332000.0
leaptron engineering pte ltd,516460.0
lecip (singapore) pte. ltd.,286625.0
lectrix engineering pte. ltd.,3626000.4
led signs pte. ltd.,165045.2
lee & lee,1042000.0
lee & lee consultants pte ltd,950000.0
lee & lim international,85550.0
lee hou koon,20250.0
lee hung scientific pte ltd,123325.0
lee sin pte. ltd.,130000.0
leeden fire safety pte. ltd.,612850.0
leeden national oxygen ltd.,2290853.0
lego house pte. ltd.,315300.0
leica microsystems (sea) pte ltd,2431125.3000000003
leighton contractors (asia) limited (singapore branch),494581448.0
leistritz sea pte. ltd.,760000.0
leisure frontier (s) pte. ltd.,203300.0
lek consulting pte limited,990000.0
lek hung moulding pte ltd,185000.0
lek san construction pte ltd,20577897.009999998
lelab sdn.bhd.,51636.74
leng hiang catering,960304.5
lennartz electronic gmbh,117754.78
lentor ambulance pte. ltd.,863990.0
leong hin seng civil engineering pte ltd,2570533.0
leong poon & assoc. pte. ltd.,159000.0
lew registered surveyor,260000.0
lexbuild international pte. ltd.,1316000.0
lexical technology pte ltd,522800.0
lexon furniture & construction pte ltd,608000.0
ley choon constructions and engineering pte ltd,78696394.0
leybold singapore pte. ltd.,469000.0
lga telecom pte ltd,498002.0
lhn parking pte. ltd.,222810.83
lhoist sg pte. ltd.,16250000.0
lhoist singapore private limited,17280000.0
lhr trading co. pte. ltd.,0.0
lhw construction pte. ltd.,138800.0
li jie construction pte. ltd.,16798313.0
lian beng construction (1988) pte ltd,434780000.0
lian cheng contracting pte ltd,6088104.0
lian ho lee construction (priv ate) limited,210118650.0
lian hoe decor pte. ltd.,651775.15
lian huah engineering pte ltd,2683700.0
lian hup seng furniture contractor company,1005280.0
lian mong international sdn. bhd.,94535.0
lian shing construction co pte ltd,12599895.0
lian soon construction pte ltd,87989000.0
lian soon m & e pte ltd,18690270.0
lian teck construction pte ltd,1680000.0
liang seng sports equipment pte ltd,99500.0
"libby, perszyk, kathman pte. ltd.",172700.0
liberty insurance pte ltd,600065.0
liberty international underwriters pte. ltd.,612810.0
libraryforce limited,562419.0
life skills centre,203829.0
life technologies holdings pte. ltd.,13939493.999999998
lifeforce maintenance & services,475980.0
lifeskills enrichment pte ltd,242683.8
lift hub engineering pte. ltd.,1007427.6
light10 industries pte. ltd.,429444.5
lightcraft pte ltd,35559.0
like building materials (s) private ltd.,400179.0
lilian florence elizabeth ing,153200.0
lim chye heng sand & granite pte ltd,52.94
lim kim cheong,350000.0
lim tan motor pte ltd,74008.1
lim yak koon & sons sdn bhd,1283367.2
lim yak koon & sons sdn.bhd.,9643.06
limra engineering pte. ltd.,703000.0
lin keong projects pte ltd,1785119.0
linde gas singapore pte. ltd.,239400.0
linear dots production pte. ltd.,371853.63
link electrical pte. ltd.,1106784.0
link fab technologies pte ltd,1317944.0
linkedin singapore pte. ltd.,99700.0
lins advertising & marketing pte ltd,2024141.5199999998
lion city show supply pte. ltd.,262220.0
lion global investors limited,80.6
liong construction pte ltd,1940039.7
liquidlab communications pte. ltd.,78550.0
listen to serve pte. ltd.,389760.0
lita ocean pte. ltd.,5934500.0
litewell engineering pte ltd,218000.0
lithoz gmbh,499400.0
little red dot enterprise,46200.0
little swan air-conditioning & engineering pte. ltd.,9526915.0
liu & wo architects pte ltd,4126304.98
living calendars pte. ltd.,398862.60000000003
lj energy pte. ltd.,675000.0
ljw resources pte. ltd,140800.0
lkh precicon pte. ltd.,80000.0
lkk auto consultants pte ltd,319000.0
"llc ""kaskad-holding""",101440.0
lloyd's register asia,148000.0
lms technologies pte ltd,2689553.0
locker & lock pte. ltd.,58185.0
logicalis singapore pte. ltd.,4294400.5
logicode pte ltd,73580.0
logistics construction pte ltd,42292800.0
lok resources pte ltd,300000.0
londonbob design,93700.0
look architects pte. ltd.,6.5
lotek wireless inc.,88643.53
love me knot,187605.0
lovely landscape and construction pte. ltd.,1109400.0
lowe refrigeration pte. ltd.,96168.66
loyang marine pte. ltd.,600760.0
lph catering,2183920.0
ls 2 services pte ltd,4883494.91
lsh industrial solutions pte ltd,319578.3
lsw consulting engineers pte. ltd.,0.0
lt&t avid architects pte. ltd.,0.0
lts group pte. ltd.,862.0
lucas & builders pte ltd,79000.0
lucky joint construction pte. ltd.,338192.0
luft env technologies pte. ltd.,142255.0
lum chang building contractors pte ltd.,325000000.0
lumitron pte. limited,5181346.0
luova engineering pte. ltd.,2341220.0
lux research - asia pacific pte. ltd.,245000.0
luxlight pte. ltd.,590949.0
lyl consultants pte. ltd.,34758200.0
lysaght corrugated pipe (s) pte. ltd.,81900.0
lyv connections pte. ltd.,199203.0
m & c saatchi (s) pte ltd,4935146.0
m s r engineering pte. ltd.,470661.0
m-fusion pte ltd,2111103.0
m-squared lasers limited,202088.25
m-stars engineering & construction pte. ltd.,6770017.0
m-tech air-con & security engineering pte ltd,1421400.0
m/s carrier midea india pvt ltd,1367646.62
m1 limited,6940817.4399999995
m1 net ltd.,40505308.33
m8m pte. ltd.,349000.0
ma builders pte ltd,7366823.0
mac transport service,630444.0
maco technical pte ltd,1240078.99
macro events pte ltd,2909303.5
macrogen inc.,434700.0
macrovic enterprise pte ltd,3857096.5
mactech engineering & trading pte. limited,1001830.0
magma builders pte ltd,985779.0
maha arul sithi construction & engineering pte ltd,168800.0
mahrinas (m) sdn. bhd.,601560.0
mainguard security services (s) pte ltd,242560.0
mainland press pte ltd,3290.0
maintech engineering & supplies pte. ltd.,7639287.65
majestic research services asia pte. limited,254650.0
majic communications pte. ltd.,288000.0
make design,115630.0
makino asia pte ltd,747453.0
malaysia dairy industries private limited,90000.0
management centre of asia pte. ltd.,267500.0
mandarin opto-medic co pte ltd,110389.0
mandarin orchard singapore,622804.8
mandate communications (s) pte. ltd.,5156358.649999999
manitou asia pte ltd,154000.0
manning selvage & lee singapore,392400.0
manteena security (aust) pty ltd,445620.77
mao sheng quanji construction pte ltd,61800190.0
marchwood laboratory services pte. ltd.,4212998.0
marcorp integrated pte. ltd.,1000000.0
marina bay sands pte. ltd.,4279722.7
marina mandarin,2005456.31
marina technology and construction pte ltd,9861929.0
marketech integrated pte ltd,3764712.0
markono print media pte ltd,135994.59
marsh (singapore) pte ltd,1255002.21
marshall cavendish education pte. ltd.,15788.35
marshall cavendish international (asia) private limited,210500.01
marunda utama engineering pte ltd,8409300.0
maryland nursery,285000.0
master contract services pte ltd,163000000.0
mastercraft systems private limited,1568888.0
mastereign learning journeys pte. ltd.,1507811.0
mastermark pte ltd,287745.0
matcor equipment & services pte. ltd.,223500.0
materion advanced materials technologies and services far east pte. ltd.,307431.16
matsushita greatwall corporation private limited,126980.0
mattress international pte. ltd.,560748.0
maven lab private limited,1481476.0
maxcon construction & engineering pte ltd,2643053.0
maxima engineering services,129400.0
maximum employment marketing group singapore pte. ltd.,153805.7
maxwell geosystems pte. ltd.,8324000.0
maxxmedia international pte. ltd.,107840.0
maytronics australia pty ltd singapore branch,322732.0
mazars llp,219600.0
mcbel builders pte. ltd.,299000.0
mccann worldgroup (singapore) pte. ltd.,3176884.5
mcconnell dowell s.e.a. pte ltd,103053188.0
mci career services pte. ltd.,200000.0
mci group asia pacific pte. ltd.,6106338.6
"mckinsey & company singapore, pte ltd",3734000.0
"mcmurdo, inc.",6183366.0
mcyc community services society,74806.0
measurement & metrology (s) pte ltd,155201.0
measurement & verification pte. ltd.,4127300.0
mech-power generator pte. ltd.,572000.0
mechantronic engineering pte ltd,362880.0
meco equipment engineers b.v.,1400975.0
mecomb s'pore ltd,4728179.0
mectron engineering pte ltd,842220.0
medi - life saving training centre,180000.0
media architects pte. ltd.,371392.15
media research consultants pte ltd,6637265.0
mediacom singapore,534366.4
mediacorp pte. ltd.,5270662.0
mediacorp tv singapore pte ltd,257610.0
medialink printing services pte ltd,1475500.0
mediamac pte ltd,1026794.0
mediashock productions pte. ltd.,216660.0
mediatech marketing pte ltd,1498.0
mediatechnic solutions pte. ltd.,737984.0
medical imaging systems pte. ltd.,140508.0
medicell pharmaceutical (s) pte ltd,708000.0
medios associate pte. ltd.,408330.0
mediwell enterprise pte ltd,222090.0
mega exhibition events private limited,757420.0
mega international,5179164.4
mega laser support private limited,120366.0
megabuilders & development pte. ltd.,9989148.0
megachem limited,309883.8
megaforce marketing pte ltd,783400.0
megastone holdings pte ltd,134145000.0
mei de engineering pte ltd,869600.0
meida construction pte. ltd.,12205000.0
"meiki co., ltd.",528059.4
meinhardt (singapore) pte ltd,3200530.62
meinhardt facade technology (s) pte ltd,264300.0
meinhardt infrastructure pte ltd,138350.0
meizhuan builders pte ltd,18682589.0
melioris private limited,44980.0
meltwater singapore pte. limited,4263000.0
memiontec pte ltd,47872145.0
mendaki social enterprise network singapore pte. ltd.,562710.0
mendel verlag gmbh & co.kg,250000.0
mercedes benz of arlington,118107.71
mercedes-benz taiwan ltd.,100817.2
mercer (singapore) pte. ltd.,8411923.0
mercer investment solutions (singapore) pte. ltd.,540250.0
merck pte. ltd.,532506.78
messer eutectic castolin (s) pte. ltd.,228000.0
meta fusion pte ltd,50800.0
metabo-profile biotechnology (shanghai) co. ltd.,124800.0
metalworld pte ltd,457940.0
metaphor design + architecture pte. ltd.,1265614.4
metcore international pte. ltd.,4400.0
methodist welfare services,25651301.0
metia pte. ltd.,407650.0
metro parking (s) pte ltd,36626.0
metrohm singapore pte ltd,271081.95
"metron aviation, inc.",21755828.0
metropolitan fishery group pte. ltd.,1450.0
mettler-toledo (s) pte ltd,1067518.81
mexplay (singapore) pte. ltd.,418400.0
meyer burger (netherlands) b.v.,714340.0
mf tech,685083.75
mft-sg pte. ltd.,812353.0
mgg software pte. ltd.,2.0
mhe-demag (s) pte ltd,261327.0
mhi training master,105000.0
mice ranking pte. ltd.,420900.0
micro photo acoustics inc.,515736.0
micrographics data pte ltd,525494.6
microimage systems pte. ltd.,142576.0
microlambda pte ltd,1674500.0
microsoft regional sales corporation,428819.0
"microxact, inc.",188193.25
midas engineering & services private limited,1099843.12
mie-tech engineering & construction pte ltd,6527339.02
milabs b.v.,1099951.0
"military freefall solutions, inc.",340921.16
militech international pte. ltd.,4151000.0
millenium partners pte. ltd.,108000.0
million bus transport services,86400.0
million lighting co pte ltd,0.41
miltenyi biotec asia pacific pte. ltd.,902812.42
milton exhibits (singapore) pte. ltd.,5579987.82
milton press co pte ltd,0.06
min hwa envelope manufacturers pte. ltd.,940443.61
mind lens worldwide pte. ltd.,539420.0
mind map training centre pte ltd,120.0
mindpower innovations pte. ltd.,5424.0
minerva industrial & trading pte. ltd.,2986227.0
mini environment service pte ltd,3075380.0
minitheory pte. ltd.,25000.0
mintel (consulting) singapore pte. ltd,206700.0
mintonette sports management,707034.0
mirage supplies pte. ltd.,225.0
mirai electronics pte. ltd.,81000.0
mirxes pte. ltd.,1831580.0
mitra engineering services pte ltd,114026.0
mitsubishi corporation,28000000.0
mitsubishi electric asia pte ltd,1275400.0
"mitsuboshi diamond industrial co., ltd.",350000.0
mitsui-soko (singapore) pte ltd,903296.0
mitutoyo asia pacific pte. ltd.,198000.0
mk events and prints (pte. ltd.),179328.0
mkpl architects pte. ltd.,1737004.23
mks global pte. ltd.,681155.0
mks instruments (singapore) pte. ltd.,268639.04000000004
mkv engineering and trading services pte. ltd.,3262724.0
ml consulting pte ltd,8649817.3
ml international trading pte. ltd.,8624063.0
ml research consultants pte ltd,3539173.0
mls (overseas) limited,949549.4
mo design,856231.54
mobile 333 pte ltd,172050.0
mobile workforce solution pte. ltd.,6090058.0
mobiquest solutions pte. ltd.,1492474.0
mode architects private limited,386000.0
modern link pte. ltd.,494566.8
modern pools pte. ltd.,130800.0
modus consulting pte. ltd.,323900.0
modutek corp.,458038.0
moephosis concepts pte. ltd.,155820.0
mohammad aslam bin jaffar,160.0
momenta group pte. ltd.,235951.0
mona computer systems (s) pte ltd,17315.92
mongoose publishing pte. ltd.,677094.0
monster av pte. ltd.,483430.0
monzone air-conditioning pte ltd,4200000.0
moo choo enterprises pte. ltd.,129358.0
morgans group pty ltd,408424.5
morning star community services,69300.0
mos group pte. ltd.,148000.0
mosen limited,174000.0
mothers and sons,89984.0
mothership.sg ltd.,400000.0
motion smith,108437.1
motorway ssangyong pte. ltd.,122570.0
mott macdonald singapore pte limited,2328280.0
mp singapore pte. ltd.,2635593.5
mq spectrum pte. ltd.,4739805.0
mr tan kim leng,2400.0
ms first capital insurance limited,5292041.76
ms11 engineering pte. ltd.,107474.0
ms11 pte. ltd.,5341799.0
msig insurance (singapore) pte. ltd.,141320.0
mss security pty limited,3646712.91
msts asia (s'pore) pte. ltd.,673894.0
mu interior pte ltd,256880.0
mulan gallery pte. ltd.,147250.0
multi-zones marketing pte ltd,2.0
multimedia people pte ltd,507062.0
multinine corporation pte. ltd.,213420.0
multiply architects llp,424800.0
multistor storage solution providers pte ltd,1004925.0
multitask development pte. ltd.,1658958.0
multitouch asia pte. ltd.,118800.0
multivac pte. ltd.,95900.0
multron systems pte ltd,1787768.98
munseh engineering sdn.bhd.,13094947.600000001
munters pte ltd,393600.0
muse inc. singapore pte ltd,3052842.0
mutech pte ltd,84600.0
mutiara (fe) pte. ltd.,208100.0
my electronic enterprise,11536.71
my private chef pte. ltd.,90632.0
myanmar jardine schindler ltd,95739.57
myasset pte. ltd.,1170390.44
n & t engineering enterprise (pte) ltd,12389379.0
na,0.0
nafa system services pte ltd,11298370.0
naiise pte. ltd.,7024263.14
nait consulting services pte. ltd.,349737.0
nam lee pressed metal pte. ltd.,32048282.38
nam plumbing engineering pte ltd,977601.1
nam soon timber pte ltd,236000.0
"nanjing dadi construction (group) co., ltd. singapore branch",152600000.0
nano equipment pte. ltd.,3134609.6
nanoflux pte. ltd.,139900.0
