supplier_name,awarded_amt
"nanostring technologies, inc.",729571.9
nantah capital one pte. ltd.,245990.4
nanyang academy of fine arts,200000.0
nanyang cement pte. ltd.,179.99
nanyang law llc,282000.0
nanyang technological university,5218741.0
napier healthcare solutions pte. ltd.,1932000.0
nat aire builder & distribution pte. ltd.,7298800.17
national dope testing laboratory,698315.0
national heart centre of singapore pte ltd,201600.0
national institute of education,1983000.0
national instruments singapore (pte) ltd,467756.74
national university hospital (singapore) pte ltd,3526090.0
national university of singapore,1252053.0
nats (services) limited,129576.0
nature japan kk,1611002.0
nature landscapes pte ltd,3045131.4
naval group far east pte. ltd.,841177.62
navblue wales limited,330000.0
navigate pte ltd,200538.0
navitech pte. ltd.,504000.0
ncs communications engineering pte. ltd.,54395600.52
ncs pte. ltd.,2257430241.72
nds lingsoft solutions private limited,214180.0
ndt instruments pte ltd,113000.0
neaspec gmbh,213889.41
nec asia pacific pte. ltd.,355661604.85999995
neew pte. ltd.,107318.5
neo lian poh construction pte ltd,5576988.4
"neocera, llc",1349874.5
neolaser solutions pte. ltd.,289400.0
neotech amt gmbh,466240.59
nera telecommunications ltd,6385899.2
netassist services pte ltd,100800.0
netatech engineering pte. ltd.,98200.0
netball singapore,70040.0
nete2 asia pte ltd,16382248.84
netrust pte ltd,1679333.39
netweb pte. ltd.,496912.0
network architects pte. ltd.,982973.04
network for electronic transfers (singapore) pte ltd,2383481.0
neuroleadership group pte. ltd.,33000.0
new art interior pte ltd,10195568.0
new horizon development pte ltd,678000.0
new shan travel service pte. ltd.,252110.0
new solution holdings pty ltd,145000.0
new universal solution,18900.0
new world international pte. ltd.,124320.0
new-e security pte ltd,4930800.0
newbase content pte. ltd.,1225828.0
newcon builders pte. ltd.,289460000.0
newgens pte ltd,82690.0
newman entertainment international pte. ltd.,1970000.0
newmark grubb knight frank,992923.46
newport opto-electronics technologies (singapore) pte. ltd.,736037.75
newrocare technology pte. ltd.,472937.0
news search (singapore) pte. ltd.,1272100.0
newstead technologies pte ltd,3363058.68
newtech engrg construction pte ltd,217450.0
nextan pte ltd,113217.0
nexus consultancy services pte ltd,43600.0
nexus link pte. ltd.,7260030.07
nexwave telecoms pte. ltd.,819295.0
nezavisimost premier auto,63798.97
nga benefits singapore pte. ltd.,281000.0
ngee cheng electric company (private) limited,146233000.0
ngo chew hong edible oil pte. ltd.,1117230.0
nie international private limited,261375.0
niit technologies pte. ltd.,1573679.0
nikko asset management asia limited,766000.0
niko enterprise pte. ltd.,0.0
nikon singapore pte ltd,2397119.0
nimrod engineering pte ltd,38201.0
nine-v entertainment pte. ltd.,98600.0
ninemer public relations pte. ltd.,3175835.0
"ningbo construction group co., ltd. (singapore branch)",38415000.0
nishimatsu construction co ltd,340118000.0
nitto denko (singapore) pte ltd,146358.9
nityo 3p solutions pte. ltd.,3068655.4000000004
nk international services,1692000.0
nkh building services pte. ltd.,7775355.0
nmc management centre pte. ltd.,187200.0
noah agencies 'n' marine services pte ltd,140300.0
nobeltech pte. ltd.,332600.0
noel gifts international ltd.,3450000.0
noise & vibration control engineering pte ltd,1011589.0
"north american science associates, inc.",114514.45
northcroft lim consultants pte ltd,0.0
northsea consultant pte. ltd.,131400.0
noryous birds & wildlife services,27647.93
nose who knows pte. ltd.,190500.0
notch productions pte. ltd.,989000.0
note printing australia limited,29199318.72
novaars international pte ltd,7772680.0
novacitynets pte ltd,34204611.0
novaglobal pte ltd,166020.0
novartis (singapore) pte ltd,19367000.0
novatiq pte. ltd.,387820.0
novem healthcare pte ltd,1147500.7
novus digital solutions pte. ltd.,664664.0
novus media solutions pte. ltd.,487130.0
nowplaying,132400.0
npe print communications pte. ltd.,1.0
nscc services pte. ltd.,9240.0
nsearch global pte. ltd.,1643272.55
nsk heat exchangers pte. ltd.,1397848.4
nsl chemicals ltd,3113000.0
nsl oilchem waste management pte. ltd.,70725.0
ntegrator pte ltd,655285.0
ntt data business solutions singapore pte. ltd.,1506527.71
ntt data singapore pte. ltd,4239477.0
ntt singapore pte. ltd.,1921828.53
ntuc fairprice co-operative ltd,3981743.94
ntuc health co-operative ltd,564.0
ntuc income insurance co-operative ltd,7424624.1
ntuc learninghub pte. ltd.,9103510.16
nu systems pte. ltd.,8480508.0
nucleus events production pte. ltd.,373424.0
nuctech singapore private limited,253000.0
nuh referral laboratories pte ltd,383665.0
nuvista technologies pte. ltd.,598680.0
nuvola media pte. ltd.,99548.0
"nylect engineering (shanghai) co., ltd",180578.4
o builders pte. ltd.,504000.0
o k g construction & trading pte ltd,2755810.0
o liner technology pte ltd,33212340.0
o'connor's singapore pte ltd,9280130.0
o'meteor creative artel pte. ltd.,72100.0
oak consulting pte. ltd.,279558.0
oberthur fiduciaire sas,923066.81
objectifs pte. ltd.,102500.0
occasions catering pte. ltd.,78.0
ocean butterflies music pte. ltd.,91484.0
ocean newline industries pte ltd,585.0
octopus design & consultant pte. ltd.,118750.0
octopusinc llp,177256.0
odyssey concepts pte. ltd.,1417074.7
odyssey marine pte. ltd.,5273300.0
oes technology pte. ltd.,267860.0
office planner pte ltd,4866182.0
ogilvy & mather (singapore) private limited,10860580.8
ogilvy public relations worldwide inc.,769209.2
ogp konsult pte. ltd.,956400.0
ohin construction co. pte. ltd.,22181280.0
oia pte ltd,142800.0
okada-mcs pte ltd,9823000.0
oliver ho & associates,88000.0
oliver wyman pte. ltd.,1050000.0
olympus singapore pte ltd,2529563.5
omc international pty. ltd.,98000.0
omd singapore pte. ltd.,2670032.0
omega scientific pte ltd,81500.0
omega scientific taiwan limited,614643.5
omnisense systems private limited,783000.0
omphalos pest services sdn bhd,15083.71
omron electronics pte ltd,136000.0
on demand systems pte. ltd.,1342108.0
one champion pte. ltd.,8805.0
one marina property services pte. ltd.,8420862.059999999
one nine seven six pte. ltd.,160372.0
one9ninety pte. ltd.,399778.0
oneberry technologies pte. ltd.,22102902.0
onemaker group pte. ltd.,354816.0
oneq pte. ltd.,860493.0
onetoone interactive pte. ltd.,398000.0
ong & ong pte. ltd.,4897133.0
ong teng chong building contractor pte ltd,1880000.0
ong yao kwang,129600.0
onthestreets photography,22775.0
op3 international pte. ltd.,427140.0
open text (asia) pte. ltd.,890890.0
openfeel pte. ltd.,3420892.7800000003
opstron pte. ltd.,133875.0
option gift pte. ltd.,2399903.1
or kim peow contractors (private) limited,143927000.0
or kim peow contractors (private) limited / cpg consultants pte ltd,97002940.0
oracle corporation singapore pte ltd,2676542.5399999996
orange business services singapore pte. ltd.,1955625.48
orange room pte. ltd.,320715.0
orchard parade hotel,76076.0
orchid country club,1181998.0
organisation resilience management pte. ltd.,135480.0
orient natural resources pte. ltd.,11368834.030000001
oriental solutions pte. ltd.,19999.98
original media private limited,279006.0
orion integrated services pte. ltd.,1523579.6
orissa international pte. ltd.,92000.0
orthodontic & dental supplies pte ltd,15000.0
osacar city audio visual pte. ltd.,287000.0
otis elevator company,36070.32
otis elevator company (s) pte ltd,9759295.3
otmh pte. ltd.,7200.0
otn building cost consultants pte. ltd.,2.2
otogenetics corporation,127449.0
otto waste systems singapore pte ltd,187572.0
oung construction (s) pte ltd,53058526.0
outback initiatives,1583551.2
outdoor specialist pte. ltd.,79500.0
ovum pty ltd,192300.0
oxford graphic printers pte ltd,130051.0
oxford instruments nanotechnology tools limited,1420000.0
oxygen studio designs pte. ltd.,861711.0
oyez communications pte. ltd.,747815.0
p & a link pte ltd,6340837.15
p & e technical services pte ltd,596000.0
p & t consultants pte. ltd.,0.0
p s p maintenance services,65670.0
p'art 1 design pte ltd,485610.0
p-one (s) pte. ltd.,13885176.0
p-way construction & engineering pte. ltd.,20298504.0
p. narayan associates,21090.0
pac instruments asia pte. ltd.,229109.5
pac-west travel (s) pte ltd,111188.0
pacific arena pte. ltd.,957056.97
pacific central teknik pte ltd,53100.0
pacific century consulting pte ltd,455265.0
pacific cool air-con services pte. ltd.,1402879.54
pacific electronics (s) pte. ltd.,308400.0
pacific reliance pte ltd,376181.0
pacific synergy pte ltd,452311.2
pacific world meetings & events singapore pte. ltd.,3066146.5
pacificlight energy pte. ltd.,8042456.42
pact builders pte. ltd.,897000.0
padang & co pte. ltd.,642001.5700000001
pae design and facility management,1289967.91
pal consultancy pte. ltd.,827.0
pal-link construction pte. ltd.,64860770.0
palfinger asia pacific pte. ltd.,103593.0
palico biotech pte ltd,674008.0
pall filtration pte ltd,755912.0
pan alliance technology international pte. ltd.,6670200.0
pan asian holdings limited,290000.0
pan master craft construction pte. ltd.,940673.0
pan pacific hotels group limited,124729.0
pan-malayan pharmaceuticals pte ltd,93600.0
panasonic asia pacific pte. ltd.,1728875.17
pang catering,2563977.47
pantech construction pte. ltd.,257400.0
panthu geological services co-operative ltd,251511.3
papendorf software engineering gmbh,659230.0
paperclip communications pte ltd,349860.0
park systems corp.,137500.0
parklink pte. ltd.,4023833.0
parkway college of nursing & allied health pte. ltd.,692000.0
parkway laboratory services ltd.,423500.0
parkway shenton pte ltd,3431316.0799999996
passion cove,97350.0
patroids creative works pte ltd,242880.0
pave system pte ltd,6631889.0
pb&m pte. ltd.,1115650.0
pba (s) pte ltd,72300.0
pba systems pte ltd,124650.0
pbt engineering pte ltd,64204377.0
pcs security private limited,76960682.0
pdsen pte. ltd.,151200.0
pdx intercompany exchange pte ltd,172800.0
peapes footwear pte ltd,50160.0
pearson education south asia pte. ltd.,300000.0
pebbleroad pte. ltd.,786000.0
pec ltd.,8742226.0
peck tiong choon transport pte. ltd.,1052780.0
pedro investigations & security services pte ltd,1853856.0
pencil group pte. ltd.,708600.0
peng chuan engineering construction pte. ltd.,2069000.0
peng yap m&e systems pte ltd,1749000.0
penguin international limited,1.0
penta-kohden marketing pte ltd,15647042.0
penta-ocean construction co ltd,1354831948.0
people advantage pte. ltd.,42878927.22
pep id-construction pte. ltd.,225437.0
perform industries pte. ltd.,13331333.0
performance motors ltd,3487540.0
pericomp solutions pte. ltd.,500000.0
perkinelmer singapore pte ltd,10310102.0
perniagaan soon huat,10926.47
perniagaan tunas harapan,231730.0
perrett laver limited,958761.0
"perris valley aviation services, inc.",286901.22
pest-pro management pte. ltd.,10614434.86
pesticide pest control pte ltd,91224.0
pestkare pte. ltd.,659520.0
peter's environmental products & services pte ltd,575900.0
petroseis sdn. bhd.,56107.6
pf fareast pte. ltd.,6240.0
ph consulting pte. ltd.,951945.0
pharaoh entertainment llp,56500.0
pharmaceutical society of singapore,222000.0
phd singapore pte. ltd.,6000000.0
"phoenix security system co., ltd",82208.2
phoenix solar pte. ltd.,3670992.0
photocraft photography,2100.0
photoinc llp,698.0
photonitech (asia) pte. ltd.,171390.0
photoplay,265474.0
photovoltaic engineering pte. ltd.,251160.0
phuture international pte. ltd.,105153.72
physio technics,100.0
pi4 robotics gmbh,146672.0
pico art international pte ltd,74154919.07000001
pico guards pte ltd,7648570.0
pico international llc,49100.0
picture me digital technology pte. ltd.,54000.0
picture people plan pte. ltd.,4450.0
pikasa builders pte. ltd.,389888.0
pin si kitchen pte. ltd.,392664.0
pinebridge investments singapore limited,1.0
pines food delight pte. ltd.,487770.0
ping engineering (s) pte. ltd.,2070900.0
pink apple pte. ltd.,320964.0
piramal enterprises limited,928975.0
pirtek asia pte ltd,195000.0
pivotal youth pte. ltd.,281001.35
pje group pte. ltd.,715545.0
planar one & associates pte ltd,102709711.0
planartech uk limited,564425.0
planet events,356882.5
plantwerkz pte. ltd.,4263427.9
playinc pte. ltd.,436940.0
playpoint (singapore) pte ltd,122985.0
pleodata pte. ltd.,228800.0
plus collaboratives limited liability partnership,623600.0
pm link pte ltd,416188.65
pmps liner technology (singapore) pte. ltd.,20553716.0
poh kee printing,99000.0
poh keong construction pte. ltd.,538000.0
poh meng engineering pte. ltd.,2552441.0
point design city development pte. ltd.,171000.0
poise image international,148350.0
polaris consulting & services pte. ltd.,1477625.0
polaris science pte. ltd.,90450.0
polkadot contractors,150000.0
polwel co-operative society limited,5719431.0
poly-m pte. ltd.,85000.0
polymer technologies pte ltd,240000.0
polytek engineering,43655.0
polytrust technologies (s) pte ltd,1441000.0
pomeroy studio pte. ltd.,295000.0
pomex pte. ltd.,167020.0
popular book company pte ltd,6497733.0
porta pumper pte ltd,615687.0
portsdown scientific pte. ltd.,1686762.99
positive engineering pte ltd,7278591.0
possible worldwide pte. ltd.,2244832.0
potential hitech industries (s) pte. ltd.,656796.95
powen engineering pte. ltd.,87625000.0
power automation pte ltd,1308659.0
power force technologies pte ltd,4623736.77
power-vac industrial services pte. ltd.,64995.0
powerpack industries pte ltd,147345.0
powersoft engineering pte. ltd.,1421695.0
pp consulting,605200.0
pq builders pte ltd,3501607.0
pqs consultants pte. ltd.,57000.0
precious treasure pte ltd,141200.0
precise development pte. ltd.,102961126.3
precision fabricators (s) pte ltd,6913497.5
precision technologies pte ltd,17342337.299999997
premier engineering & trading pte. ltd.,129150.0
premier security co-operative ltd,2334582.0
premier solutions pte. ltd.,261512.0
premium automobiles pte ltd,532964.0
presico engineering pte. ltd.,20892000.0
presscrete engineering pte ltd,11228000.0
prestige bioresearch pte. ltd.,394776.0
prestige enviro-care pte. ltd.,308976.0
prestige label pte ltd,146538.06
prestige laundry and cleaning pte. ltd.,26071.2
"prestige public relations international co., ltd",596332.8
prestige solutions pte. ltd.,32000.0
prevac spolka z orgraniczona odpowiedzialnoscia,3088155.36
pricewaterhousecoopers advisory services pte. ltd.,650000.0
pricewaterhousecoopers consulting (singapore) pte. ltd.,4225815.8
pricewaterhousecoopers llp,11165778.53
pricewaterhousecoopers risk services pte. ltd.,2939006.0
pricewaterhousecoopers singapore pte. ltd.,343700.0
prima limited,2858527.6
prime gymnastics club,307920.0
prime power (s) pte ltd,668400.0
prime structures engineering pte ltd,2296220.0
primech services & engrg pte ltd,15866955.0
primo guards private limited,2193440.0
primustech pte. ltd.,25833570.0
prince's landscape and construction pte ltd,31726800.499999996
priora fm sa,2071051.54
priya moviebuzz pte. ltd.,87420.0
pro interactive services india pvt ltd,366289.94
pro-ace power & control pte ltd,11871936.0
pro-datech systems pte ltd,103672.0
pro-matrix pte ltd,9371999.0
procems asia-pacific pte ltd,647020.0
procolor separation & print pte. ltd.,176958.0
product development solutions pte. ltd.,499634.0
"professional testing, inc.",16457.0
progen pte ltd,138000.0
progressive builders private limited,375379000.0
project innovations pte. ltd.,510400.0
project peanut pte. ltd.,174000.0
prolight engineering pte. ltd.,1803900.0
promega pte. ltd.,2897565.0
proof perfect pte ltd,115170.0
proof-tech waterproofing & maintenance pte. ltd.,933575.0
propell integrated pte ltd,22954564.0
property care services (cambodia) co. ltd.,137463.93
property facility services pte. ltd.,1625934.06
property maintenance & gardens incorporated,228615.0
proquest llc,142984.72
prosegur singapore pte. ltd.,11317800.0
prospaq group pte. ltd.,34.519999999999996
protiviti pte. ltd.,373200.0
"protochips,inc.",205822.0
protocol pte. ltd.,67000.0
prowler international pte. ltd.,253680.0
psytech limited,1533145.0
pt bewe kharisma komunika,728013.83
pt environmental indokarya,2137504.32
pt gitacipta selaras,1053449.39
pt toyota astra motor,92317.32
pt. bestindo car utama,56663.55
pt. chroma international,275000.0
ptc system (s) pte ltd,5199522.4
pu xing concept builders pte. ltd.,449000.0
public air technology pte ltd,186840.0
publicis singapore,7400436.0
puretech engineering pte ltd,6784265.3
purple circle design pte ltd,276509.8
purpleclick media pte. ltd.,526275.0
purpleforest events pte. ltd.,213150.0
putra water treatment pte. ltd.,2915314.0
pv vacuum engineering pte ltd,12784599.0
pvcg pte. ltd.,330000.0
pypun-kd & associates limited,4272340.0
q research consulting llp,89250.0
q's advertising pte. ltd.,8405376.67
q'son kitchen equipment pte ltd,148340.0
q-auto l.l.c,221600.0
qais consulting pte. ltd.,333344.0
qbh pte. ltd.,3010000.0
qci lab engineering pte. ltd.,158970.0
qcube pte. ltd.,38870.0
qe elemech engineering pte. ltd.,786240.0
qes (singapore) pte ltd,128000.0
qiagen singapore pte. ltd.,625224.5
qian hu tat leng plastic pte. ltd.,464400.0
qing feng construction pte ltd,44850450.0
"qingjian international (south pacific) group development co., pte. ltd.",324939000.0
qool enviro pte. ltd.,936000.0
qs-first pte ltd,1439023.0
qst dental pte. ltd.,136000.0
qt instruments (s) pte ltd,746874.1799999999
quadunion builders pte. ltd.,34859340.0
quann asia pacific pte. ltd.,2529379.6
quann singapore pte. ltd,7209810.96
quanterix corporation,243500.0
quantum automation pte ltd,5229449.0
quantum consumer solutions pte. ltd.,384000.0
"quantum design (beijing) co., ltd.",233850.0
"quantum design international, inc.",1771435.7399999998
"quantum design international,inc. southeast asia branch",487941.84
quantum inventions private limited,591800.0
quantum technologies global pte. ltd.,290358.0
quasi-s pte. ltd.,389242.8
quek & quek civil engineering pte ltd,184159268.0
quek and tan building contractors pte ltd,4483637.0
quek hock seng construction (pte) ltd,48572938.0
quest technology (s) pte ltd,4380417.0
quickstart technology pte. ltd.,1101811.0
quin right enterprises (pte) ltd,2882101.97
quintech life sciences pte. ltd.,40535.0
quintiles east asia pte ltd,214000.0
qvista pte. ltd.,614025.0
qxy resources pte. ltd.,54929902.0
r a international marketing,425774.86
r.j. crocker consultants pte. ltd.,1436255.0
r2c pte. ltd.,433557.0
r3 asia pacific pte. ltd.,2334683.0
r3 engineering pte. ltd.,610670.0
radiant optronics pte. ltd.,168820.0
radius design & construction pte ltd,16850606.78
raffles health insurance pte. ltd.,354712.0
raffles medical group ltd,4087673.1
raffles studio pte ltd,1755.0
rainbow company,276540.0
raintree medical pte. ltd.,110400.0
"raise, inc.",110123.0
rajah & tann singapore llp,187384.0
ram i pte. ltd.,126940.0
ramboll environ singapore pte. ltd.,560819.0
ramboll studio dreiseitl pte. ltd.,1219000.0
ramky cleantech services pte. ltd.,21070574.23
ramo industries pte. ltd.,6320212.0
rankine & hill (singapore) pte. ltd.,3.5300000000000002
rapid biomedizinische gerate rapid biomedical gmbh,382233.04
rapid effect pte ltd,240000.0
raptech pte. ltd.,2014205.0
ras pharma & biochem pte. ltd.,106773.0
raymond construction pte ltd,33042981.0
raymond international pte ltd,59991.4
rc hotels (pte) ltd,592639.8
rc m&e pte. ltd.,1237163.0
rcy pte. ltd.,22027915.0
rdc architects pte ltd,2676000.0
rde construction pte ltd.,2939000.0
reachfield it solutions pte. ltd.,201775.24
reachfield security & safety management pte. ltd.,33339500.0
"real-time innovations, inc.",393880.2
recall total information management pte. ltd.,15083776.43
recon security limited,891559.07
recruit express pte ltd,1892704.95
red bean architects,966109.9
red dot power pte. ltd.,7.07
red element health international pte. ltd.,58600.0
red sentry pte ltd,230680.0
red-power electrical engineering pte ltd,34800.0
redbean de pte. ltd.,771160.0
reddot publishing inc. pte ltd,0.01
redstack (s) pte. ltd,878175.0
redworks (s) pte ltd,1402613.5
reed business information pte. ltd.,866140.0
reflex-o recreations pte ltd,430495.58
refresh water trading pte ltd,915330.0
region property consultancy & management services pte. ltd.,38.25
regional business network pte ltd,391518.0
regius construction & civil engineering pte. ltd.,130305.0
rejoice construction & decor co pte. ltd.,256000.0
reliance travel agencies (s) pte ltd,204152.8
rental hygiene services pte ltd,299840.0
rentokil initial singapore private limited,127602.20999999999
republic advertising consultants,209133.11
research biolabs pte ltd,209888.0
research instruments pte ltd,3343520.8
research plus pte ltd,402055.0
resem technologies pte ltd,1085800.0
"resilience, inc",224750.0
reso engineering sdn bhd,1638271.73
resolute labs pte. ltd.,432500.0
resolve salvage & fire (asia) pte. ltd.,199342.0
resorts world at sentosa pte. ltd.,3814534.16
resource piling pte ltd,32228000.0
resource travel pte. ltd.,781320.0
retrofit pte. ltd.,158760.0
reverse logistics gmbh,198680.0
revez motion pte. ltd.,2768112.5
revsolution sdn. bhd.,92573.25
rex cinemas pte. ltd.,144800.0
rfnet technologies pte ltd,9200.0
"rh systems, llc",295000.0
rht compliance solutions pte. ltd.,392000.0
rhtlaw taylor wessing llp,662861.25
rhythme technology pte ltd,6278540.0
ri dong corporation pte ltd,31990910.0
rich construction company pte. ltd.,571933750.0
rich-art enterprises pte ltd,420300.0
rich-link construction pte. ltd.,143743803.0
richz technology (s) pte. ltd.,352800.0
rick clements & associates pte. ltd.,232500.0
ricoh (singapore) pte ltd,777260.6
rider levett bucknall llp,6416800.0
rie's laundry,4960.0
riedel communications gmbh & co. kg,1819663.3499999999
rigel technology (s) pte ltd,1352682.0
right construction pte ltd,98600000.0
right dimension private limited,84000.0
right engineering pte. ltd.,1137210.0
right management singapore pte. ltd.,518480.0
right projects pte. ltd.,282500.0
rightmen security services pte. ltd.,182454.0
"ripple, llc",201772.09
risorsa umana solutions pte. ltd.,346525.0
rita metal & wooden furniture construction pte ltd,1495215.25
riveria marketing pte ltd,9779446.0
rj consultants pte ltd,107380.0
rj education group (s) pte. ltd.,57236.0
rlb consultancy pte. ltd.,0.82
rma consultants pte ltd,556596.6
rma contracts pte. ltd.,29256203.630000003
rmt co. ltd,73593.5
rn & associates pte ltd,248410.0
rnc engineering pte ltd,122930.0
robe lighting asia pacific pte. ltd.,105005.0
robert bosch (south east asia) pte. ltd.,885365.0
robert bosch security solutions pte. ltd.,5524122.0
robin village development pte. ltd.,11769115.0
robinson & company (singapore) private limited,126945.0
roche diagnostics asia pacific pte ltd,328000.0
rockcomms pte. ltd.,95725.0
rockmoon pte. ltd.,69000.0
roffey park asia pacific pte. ltd.,581175.0
roffey park institute limited,905043.7
rogue resolutions limited,771531.88
rohde & schwarz asia pte. ltd.,3210400.0
rohde & schwarz regional headquarters singapore pte. ltd.,930721.3300000001
rohei corporation pte. ltd.,1250301.0
roland berger strategy consultants pte. ltd.,915000.0
ronbuildz pte. ltd.,1221880.0
rong du building construction pte. ltd.,425710.0
rongda pacific pte. ltd.,79000.0
ronnie & koh consultants pte. ltd.,55752700.0
rosha dynamic sdn bhd,146776.63
rotary engineering limited,302473.0
roxwell pte. ltd.,445999.0
royal 88 interior design pte ltd,2885845.0
royal insignia pte ltd,159030.0
royal selangor (s) pte ltd,214310.0
rs facilities services private limited,8980810.5
rs-systems as,1164658.59
rsm chio lim llp,104000.0
rsm risk advisory pte. ltd.,277500.0
rsp architects planners & engineers (pte) ltd,7554511.41
rtmt motor pte ltd,1184550.0
ruder finn asia pte ltd,537500.0
rui feng chartered pte. ltd.,4431134.0
ryca pte. ltd.,669419.8
rynamo building services pte ltd,208800.0
ryobi geotechnique international pte. ltd.,59402133.7
ryobi kiso (s) pte. ltd.,28295751.0
ryverton enterprise,182250.0
s & i systems pte ltd,18940686.439999998
s & l innovations and technology pte. ltd.,316910.24
s a chua architects pte. ltd.,1552600.0
s e a t h societe detude et dapplication thermique (seath),177915.53
s k e engineering (s) pte ltd,536415.0
s&p system services pte. ltd.,3116650.0
s-enterprise pte. ltd.,193782.0
s-lite event support pte. ltd.,3605774.0
s. k. rosenbauer pte. ltd.,26575328.45
s.a.c. (pte) ltd,425000.0
s.c. johnson & son private lim ited,512000.0
sa dental supply pte ltd,281690.0
saa architects pte ltd,7.02
saab technologies b.v.,22910888.2
sac energy (s) private limited,2455000.0
sacac counselling pte. ltd.,1.0
safe2travel pte ltd,9910257.59
safeguard systems & services pte ltd,1212000.0
salt creatives pte. ltd.,74120.0
salzman capital ventures ltd,117112.0
sam lain equipment services pte ltd,30596827.0
samco civil engineering pte. ltd.,6535924.0
samco enterprise pte ltd,700000.0
samco inc. singapore branch,197157.13
samknows limited,1825400.0
samplearchive services pte. ltd.,4012479.0
samsung c&t corporation,2649202567.0
samwoh corporation pte. ltd.,37250000.0
samwoh corporation pte. ltd. / t.y. lin international pte. ltd.,17164200.0
samwoh resources pte ltd,8022354.57
san system productions,401258.0
sanchoon builders pte ltd,31689070.0
"sandoval landscape company, llc",162867.92
sanli m&e engineering pte. ltd.,141481363.1
sansys collective pte. ltd.,884188.0
santarli construction pte. ltd.,1178800000.0
